f172f340 2367833020 S Ci:4:001:0 s a3 00 0000 0001 0004 4 <
f172f340 2367833028 C Ci:4:001:0 0 4 = 01030100
f172f340 2367833030 S Co:4:001:0 s 23 01 0010 0001 0000 0
f172f340 2367833033 C Co:4:001:0 0 0
f172f340 2367833035 S Ci:4:001:0 s a3 00 0000 0001 0004 4 <
f172f340 2367833039 C Ci:4:001:0 0 4 = 01030000
f172f9c0 2367864986 S Ci:4:001:0 s a3 00 0000 0001 0004 4 <
f172f9c0 2367864996 C Ci:4:001:0 0 4 = 01030000
f172f9c0 2367897038 S Ci:4:001:0 s a3 00 0000 0001 0004 4 <
f172f9c0 2367897049 C Ci:4:001:0 0 4 = 01030000
f172f9c0 2367931642 S Ci:4:001:0 s a3 00 0000 0001 0004 4 <
f172f9c0 2367931649 C Ci:4:001:0 0 4 = 01030000
f172f9c0 2367963986 S Ci:4:001:0 s a3 00 0000 0001 0004 4 <
f172f9c0 2367963995 C Ci:4:001:0 0 4 = 01030000
f172f9c0 2367964002 S Co:4:001:0 s 23 03 0004 0001 0000 0
f172f9c0 2367964007 C Co:4:001:0 0 0
f172f9c0 2368018197 S Ci:4:001:0 s a3 00 0000 0001 0004 4 <
f172f9c0 2368018219 C Ci:4:001:0 0 4 = 03010000
f172f9c0 2368073634 S Co:4:001:0 s 23 01 0014 0001 0000 0
f172f9c0 2368073638 C Co:4:001:0 0 0
f172f9c0 2368073648 S Ci:4:000:0 s 80 06 0100 0000 0040 64 <
f172f9c0 2373077828 C Ci:4:000:0 -2 0
f172f9c0 2373077863 S Ci:4:000:0 s 80 06 0100 0000 0040 64 <
f172f9c0 2378077986 C Ci:4:000:0 -2 0
f172f9c0 2378078023 S Ci:4:000:0 s 80 06 0100 0000 0040 64 <
f172f9c0 2383079144 C Ci:4:000:0 -2 0
f172f9c0 2383079190 S Co:4:001:0 s 23 03 0004 0001 0000 0
f172f9c0 2383079195 C Co:4:001:0 0 0
f172f9c0 2383131983 S Ci:4:001:0 s a3 00 0000 0001 0004 4 <
f172f9c0 2383132004 C Ci:4:001:0 0 4 = 03010000
f172f9c0 2383187981 S Co:4:001:0 s 23 01 0014 0001 0000 0
f172f9c0 2383187985 C Co:4:001:0 0 0
f172f9c0 2383291981 S Ci:4:000:0 s 80 06 0100 0000 0040 64 <
f172f9c0 2388293307 C Ci:4:000:0 -2 0
f172f9c0 2388293340 S Ci:4:000:0 s 80 06 0100 0000 0040 64 <
f172f9c0 2393296464 C Ci:4:000:0 -2 0
f172f9c0 2393296500 S Ci:4:000:0 s 80 06 0100 0000 0040 64 <
f172f9c0 2393304461 C Ci:4:000:0 0 18 = 00787878 78787878 78787878 78787878 7878
f172f9c0 2393304473 S Co:4:001:0 s 23 03 0004 0001 0000 0
f172f9c0 2393304478 C Co:4:001:0 0 0
f0533cc0 2393360000 S Ci:4:001:0 s a3 00 0000 0001 0004 4 <
f0533cc0 2393360029 C Ci:4:001:0 0 4 = 03010000
f0533cc0 2393412984 S Co:4:001:0 s 23 01 0014 0001 0000 0
f0533cc0 2393412990 C Co:4:001:0 0 0
f0533cc0 2393516990 S Co:4:001:0 s 23 01 0001 0001 0000 0
f0533cc0 2393517001 C Co:4:001:0 0 0
f0533cc0 2393517017 S Co:4:001:0 s 23 03 0004 0001 0000 0
f0533cc0 2393517021 C Co:4:001:0 0 0
f0533cc0 2393572981 S Ci:4:001:0 s a3 00 0000 0001 0004 4 <
f0533cc0 2393573005 C Ci:4:001:0 0 4 = 03010000
f0533cc0 2393628981 S Co:4:001:0 s 23 01 0014 0001 0000 0
f0533cc0 2393628986 C Co:4:001:0 0 0
f0533cc0 2393628997 S Ci:4:000:0 s 80 06 0100 0000 0040 64 <
f0533cc0 2396146556 C Ci:4:000:0 -84 0
f0533cc0 2396146567 S Ci:4:000:0 s 80 06 0100 0000 0040 64 <
f0533cc0 2396150552 C Ci:4:000:0 -71 0
f0533cc0 2396150559 S Ci:4:000:0 s 80 06 0100 0000 0040 64 <
f0533cc0 2396154552 C Ci:4:000:0 -71 0
f0533cc0 2396154559 S Co:4:001:0 s 23 03 0004 0001 0000 0
f0533cc0 2396154565 C Co:4:001:0 0 0
f0533cc0 2396208986 S Ci:4:001:0 s a3 00 0000 0001 0004 4 <
f0533cc0 2396209011 C Ci:4:001:0 0 4 = 00010000
f0533cc0 2396209015 S Co:4:001:0 s 23 01 0014 0001 0000 0
f0533cc0 2396209016 C Co:4:001:0 0 0
f0533cc0 2396209019 S Co:4:001:0 s 23 01 0001 0001 0000 0
f0533cc0 2396209023 C Co:4:001:0 0 0
f0533cc0 2396209031 S Co:4:001:0 s 23 01 0001 0001 0000 0
f0533cc0 2396209035 C Co:4:001:0 0 0
f0533cc0 2396209037 S Ci:4:001:0 s a3 00 0000 0002 0004 4 <
f0533cc0 2396209041 C Ci:4:001:0 0 4 = 00010000
f0533cc0 2396209045 S Ci:4:001:0 s a3 00 0000 0001 0004 4 <
f0533cc0 2396209049 C Ci:4:001:0 0 4 = 00010000
f7504640 2398207987 C Ii:4:001:1 -2:128 0
