ec0812c0 243282873 S Ci:5:001:0 s a3 00 0000 0001 0004 4 <
ec0812c0 243282882 C Ci:5:001:0 0 4 = 01030100
ec0812c0 243282884 S Co:5:001:0 s 23 01 0010 0001 0000 0
ec0812c0 243282887 C Co:5:001:0 0 0
ec0812c0 243282889 S Ci:5:001:0 s a3 00 0000 0001 0004 4 <
ec0812c0 243282893 C Ci:5:001:0 0 4 = 01030000
ec0812c0 243314168 S Ci:5:001:0 s a3 00 0000 0001 0004 4 <
ec0812c0 243314176 C Ci:5:001:0 0 4 = 01030000
ec0812c0 243346169 S Ci:5:001:0 s a3 00 0000 0001 0004 4 <
ec0812c0 243346178 C Ci:5:001:0 0 4 = 01030000
ec0812c0 243378164 S Ci:5:001:0 s a3 00 0000 0001 0004 4 <
ec0812c0 243378172 C Ci:5:001:0 0 4 = 01030000
ec0812c0 243410165 S Ci:5:001:0 s a3 00 0000 0001 0004 4 <
ec0812c0 243410174 C Ci:5:001:0 0 4 = 01030000
ec0812c0 243410180 S Co:5:001:0 s 23 03 0004 0001 0000 0
ec0812c0 243410183 C Co:5:001:0 0 0
ec0812c0 243466171 S Ci:5:001:0 s a3 00 0000 0001 0004 4 <
ec0812c0 243466199 C Ci:5:001:0 0 4 = 03030000
ec0812c0 243522166 S Co:5:001:0 s 23 01 0014 0001 0000 0
ec0812c0 243522171 C Co:5:001:0 0 0
ec0812c0 243522185 S Ci:5:000:0 s 80 06 0100 0000 0040 64 <
ec0812c0 243529187 C Ci:5:000:0 0 18 = 12010002 00000008 b3040c31 00020002 0001
ec0812c0 243529203 S Co:5:001:0 s 23 03 0004 0001 0000 0
ec0812c0 243529210 C Co:5:001:0 0 0
ec0812c0 243582165 S Ci:5:001:0 s a3 00 0000 0001 0004 4 <
ec0812c0 243582197 C Ci:5:001:0 0 4 = 03030000
ec0812c0 243638167 S Co:5:001:0 s 23 01 0014 0001 0000 0
ec0812c0 243638172 C Co:5:001:0 0 0
ec0812c0 243638175 S Co:5:000:0 s 00 05 0003 0000 0000 0
ec0812c0 243640197 C Co:5:000:0 0 0
ec0812c0 243658164 S Ci:5:003:0 s 80 06 0100 0000 0012 18 <
ec0812c0 243663193 C Ci:5:003:0 0 18 = 12010002 00000008 b3040c31 00020002 0001
ec0812c0 243663209 S Ci:5:003:0 s 80 06 0200 0000 0009 9 <
ec0812c0 243668191 C Ci:5:003:0 0 9 = 09022200 010100a0 32
ec0812c0 243668204 S Ci:5:003:0 s 80 06 0200 0000 0022 34 <
ec0812c0 243676191 C Ci:5:003:0 0 34 = 09022200 010100a0 32090400 00010301 02000921 11010001 22340007 05810304
ec0812c0 243676211 S Ci:5:003:0 s 80 06 0300 0000 00ff 255 <
ec0812c0 243681192 C Ci:5:003:0 0 4 = 04030904
ec0812c0 243681202 S Ci:5:003:0 s 80 06 0302 0409 00ff 255 <
ec0812c0 243690192 C Ci:5:003:0 0 36 = 24035500 53004200 20004f00 70007400 69006300 61006c00 20004d00 6f007500
ec0812c0 243690308 S Co:5:003:0 s 00 09 0001 0000 0000 0
ec0812c0 243693192 C Co:5:003:0 0 0
ec0812c0 243694367 S Co:5:003:0 s 21 0a 0000 0000 0000 0
ec0812c0 243697195 C Co:5:003:0 0 0
ec0812c0 243697228 S Ci:5:003:0 s 81 06 2200 0000 0034 52 <
ec0812c0 243707201 C Ci:5:003:0 0 52 = 05010902 a1010901 a1000509 19012903 15002501 75019503 81027505 95018101
ec0812c0 243738223 S Ii:5:003:1 -115:8 4 <
ec0812c0 248602350 C Ii:5:003:1 0:8 4 = 00000100
ec0812c0 248602372 S Ii:5:003:1 -115:8 4 <
ec0812c0 248610350 C Ii:5:003:1 0:8 4 = 00fb0600
ec0812c0 248610364 S Ii:5:003:1 -115:8 4 <
ec0812c0 248618350 C Ii:5:003:1 0:8 4 = 00fb0900
ec0812c0 248618369 S Ii:5:003:1 -115:8 4 <
ec0812c0 248626348 C Ii:5:003:1 0:8 4 = 00fc0b00
ec0812c0 248626361 S Ii:5:003:1 -115:8 4 <
ec0812c0 248634358 C Ii:5:003:1 0:8 4 = 00fb0900
ec0812c0 248634383 S Ii:5:003:1 -115:8 4 <
ec0812c0 248642353 C Ii:5:003:1 0:8 4 = 00fc0500
ec0812c0 248642365 S Ii:5:003:1 -115:8 4 <
ec0812c0 248650352 C Ii:5:003:1 0:8 4 = 00ff0400
ec0812c0 248650362 S Ii:5:003:1 -115:8 4 <
ec0812c0 248658353 C Ii:5:003:1 0:8 4 = 00ff0200
ec0812c0 248658365 S Ii:5:003:1 -115:8 4 <
ec0812c0 248666356 C Ii:5:003:1 0:8 4 = 00000200
ec0812c0 248666373 S Ii:5:003:1 -115:8 4 <
ec0812c0 248762358 C Ii:5:003:1 0:8 4 = 0000ff00
ec0812c0 248762378 S Ii:5:003:1 -115:8 4 <
ec0812c0 248770356 C Ii:5:003:1 0:8 4 = 0000fe00
ec0812c0 248770366 S Ii:5:003:1 -115:8 4 <
ec0812c0 248778357 C Ii:5:003:1 0:8 4 = 0001ff00
ec0812c0 248778370 S Ii:5:003:1 -115:8 4 <
ec0812c0 248786355 C Ii:5:003:1 0:8 4 = 0001ff00
ec0812c0 248786361 S Ii:5:003:1 -115:8 4 <
