efd1f640 140030891 S Ci:2:033:0 s 80 06 0100 0000 0012 18 <
efd1f640 140031994 C Ci:2:033:0 0 18 = 12010002 00000040 81436501 00010102 0301
efd1f640 140032002 S Ci:2:033:0 s 80 06 0200 0000 0009 9 <
efd1f640 140032119 C Ci:2:033:0 0 9 = 09022700 01010080 31
efd1f640 140032124 S Ci:2:033:0 s 80 06 0200 0000 0027 39 <
efd1f640 140032244 C Ci:2:033:0 0 39 = 09022700 01010080 31090400 00030806 50000705 01020002 01070582 02000201
f544bac0 140032252 S Ci:2:033:0 s 80 06 0300 0000 00ff 255 <
f544bac0 140032619 C Ci:2:033:0 0 4 = 04030904
f544bac0 140032624 S Ci:2:033:0 s 80 06 0302 0409 00ff 255 <
f544bac0 140033118 C Ci:2:033:0 0 48 = 30035500 53004200 20004d00 61007300 73002000 53007400 6f007200 61006700
f544bac0 140033324 S Ci:2:033:0 s 80 06 0301 0409 00ff 255 <
f544bac0 140033744 C Ci:2:033:0 0 36 = 24035500 53004200 65007300 74002000 54006500 63006800 6e006f00 6c006f00
f544bac0 140033751 S Ci:2:033:0 s 80 06 0303 0409 00ff 255 <
f544bac0 140034244 C Ci:2:033:0 0 30 = 1e033000 38003000 34003100 30003000 31003000 62003800 34006300 6400
f544bac0 140034320 S Co:2:033:0 s 00 09 0001 0000 0000 0
f544bac0 140034369 C Co:2:033:0 0 0
f544bac0 145042889 S Ci:2:033:0 s a1 fe 0000 0000 0001 1 <
f544bac0 145042961 C Ci:2:033:0 0 1 = 00
f544bac0 145043050 S Bo:2:033:1 -115 31 = 55534243 01000000 24000000 80000612 00000024 00000000 00000000 000000
f544bac0 145043835 C Bo:2:033:1 0 31 >
f544be40 145043844 S Bi:2:033:2 -115 36 <
f544be40 145044835 C Bi:2:033:2 0 36 = 00800202 1f000000 55743136 35202020 55534232 466c6173 6853746f 72616765
f544bac0 145044843 S Bi:2:033:2 -115 13 <
f544bac0 145044961 C Bi:2:033:2 0 13 = 55534253 01000000 00000000 00
f544bac0 145045314 S Bo:2:033:1 -115 31 = 55534243 02000000 00000000 00000600 00000000 00000000 00000000 000000
f544bac0 145045835 C Bo:2:033:1 0 31 >
f544bac0 145045841 S Bi:2:033:2 -115 13 <
f544bac0 145046834 C Bi:2:033:2 0 13 = 55534253 02000000 00000000 00
f544bac0 145046858 S Bo:2:033:1 -115 31 = 55534243 03000000 08000000 80000a25 00000000 00000000 00000000 000000
f544bac0 145047834 C Bo:2:033:1 0 31 >
f544be40 145048036 S Bi:2:033:2 -115 8 <
f544be40 145048834 C Bi:2:033:2 0 8 = 003c3fff 00000200
f544bac0 145048841 S Bi:2:033:2 -115 13 <
f544bac0 145048959 C Bi:2:033:2 0 13 = 55534253 03000000 00000000 00
f544bac0 145048982 S Bo:2:033:1 -115 31 = 55534243 04000000 c0000000 8000061a 003f00c0 00000000 00000000 000000
f544bac0 145049834 C Bo:2:033:1 0 31 >
f544be40 145049839 S Bi:2:033:2 -115 192 <
f544be40 145050833 C Bi:2:033:2 -121 8 = 00000000 00000000
f544bac0 145050840 S Bi:2:033:2 -115 13 <
f544bac0 145051834 C Bi:2:033:2 0 13 = 55534253 04000000 00000000 00
f544bac0 145051888 S Bo:2:033:1 -115 31 = 55534243 05000000 00000000 00000600 00000000 00000000 00000000 000000
f544bac0 145052833 C Bo:2:033:1 0 31 >
f544bac0 145052839 S Bi:2:033:2 -115 13 <
f544bac0 145053833 C Bi:2:033:2 0 13 = 55534253 05000000 00000000 00
f544bac0 145053851 S Bo:2:033:1 -115 31 = 55534243 06000000 00000000 0000061e 00000001 00000000 00000000 000000
f544bac0 145054834 C Bo:2:033:1 0 31 >
f544bac0 145054840 S Bi:2:033:2 -115 13 <
f544bac0 145055834 C Bi:2:033:2 0 13 = 55534253 06000000 00000000 01
f544bac0 145055840 S Bo:2:033:1 -115 31 = 55534243 07000000 12000000 80000603 00000012 00000000 00000000 000000
f544bac0 145056833 C Bo:2:033:1 0 31 >
f544be40 145056840 S Bi:2:033:2 -115 18 <
f544be40 145057833 C Bi:2:033:2 0 18 = 70000500 0000000a 00000000 24000000 0000
f544bac0 145057839 S Bi:2:033:2 -115 13 <
f544bac0 145057959 C Bi:2:033:2 0 13 = 55534253 07000000 00000000 00
f544bac0 145057978 S Bo:2:033:1 -115 31 = 55534243 08000000 00000000 00000600 00000000 00000000 00000000 000000
f544bac0 145058833 C Bo:2:033:1 0 31 >
f544bac0 145058839 S Bi:2:033:2 -115 13 <
f544bac0 145059833 C Bi:2:033:2 0 13 = 55534253 08000000 00000000 00
f544bac0 145059852 S Bo:2:033:1 -115 31 = 55534243 09000000 08000000 80000a25 00000000 00000000 00000000 000000
f544bac0 145060833 C Bo:2:033:1 0 31 >
f544be40 145060839 S Bi:2:033:2 -115 8 <
f544be40 145061833 C Bi:2:033:2 0 8 = 003c3fff 00000200
f544bac0 145061838 S Bi:2:033:2 -115 13 <
f544bac0 145061959 C Bi:2:033:2 0 13 = 55534253 09000000 00000000 00
f544bac0 145061978 S Bo:2:033:1 -115 31 = 55534243 0a000000 c0000000 8000061a 003f00c0 00000000 00000000 000000
f544bac0 145062833 C Bo:2:033:1 0 31 >
f544be40 145062839 S Bi:2:033:2 -115 192 <
f544be40 145063833 C Bi:2:033:2 -121 8 = 00000000 00000000
f544bac0 145063840 S Bi:2:033:2 -115 13 <
f544bac0 145064833 C Bi:2:033:2 0 13 = 55534253 0a000000 00000000 00
f544bac0 145064867 S Bo:2:033:1 -115 31 = 55534243 0b000000 00100000 80000a28 00000000 00000008 00000000 000000
f544bac0 145065833 C Bo:2:033:1 0 31 >
f544be40 145065839 S Bi:2:033:2 -115 4096 <
f544be40 145124585 C Bi:2:033:2 0 4096 = eb58904d 53444f53 352e3000 02082600 02000000 00f80000 3f00ff00 00000000
f544bac0 145124597 S Bi:2:033:2 -115 13 <
f544bac0 145124708 C Bi:2:033:2 0 13 = 55534253 0b000000 00000000 00
f544bac0 145135234 S Bo:2:033:1 -115 31 = 55534243 0c000000 00000000 00000600 00000000 00000000 00000000 000000
f544bac0 145135834 C Bo:2:033:1 0 31 >
f544bac0 145135905 S Bi:2:033:2 -115 13 <
f544bac0 145136831 C Bi:2:033:2 0 13 = 55534253 0c000000 00000000 00
f544bac0 145138780 S Bo:2:033:1 -115 31 = 55534243 0d000000 00400000 80000a28 00000000 00000020 00000000 000000
f544bac0 145138957 C Bo:2:033:1 0 31 >
f544be40 145139049 S Bi:2:033:2 -115 4096 <
f22d6c40 145139051 S Bi:2:033:2 -115 4096 <
f54556c0 145139052 S Bi:2:033:2 -115 4096 <
f57f0ac0 145139053 S Bi:2:033:2 -115 4096 <
f544be40 145200207 C Bi:2:033:2 0 4096 = eb58904d 53444f53 352e3000 02082600 02000000 00f80000 3f00ff00 00000000
f22d6c40 145200211 C Bi:2:033:2 0 4096 = 00000000 00000000 00000000 00000000 00000000 00000000 00000000 00000000
f54556c0 145200212 C Bi:2:033:2 0 4096 = 00000000 00000000 00000000 00000000 00000000 00000000 00000000 00000000
f57f0ac0 145200213 C Bi:2:033:2 0 4096 = 00000000 00000000 00000000 00000000 00000000 00000000 00000000 00000000
f544bac0 145200222 S Bi:2:033:2 -115 13 <
f544bac0 145200331 C Bi:2:033:2 0 13 = 55534253 0d000000 00000000 00
f544bac0 145200423 S Bo:2:033:1 -115 31 = 55534243 0e000000 00100000 80000a28 00003c3f 80000008 00000000 000000
f544bac0 145200829 C Bo:2:033:1 0 31 >
f544be40 145200837 S Bi:2:033:2 -115 4096 <
f544be40 145302703 C Bi:2:033:2 0 4096 = 44495022 0d0a0909 20202020 7d0d0a09 0920207d 0d0a0909 2020426c 6f636b43
f544bac0 145302713 S Bi:2:033:2 -115 13 <
f544bac0 145302828 C Bi:2:033:2 0 13 = 55534253 0e000000 00000000 00
f544bac0 145302902 S Bo:2:033:1 -115 31 = 55534243 0f000000 00100000 80000a28 00003c3f f0000008 00000000 000000
f544bac0 145303827 C Bo:2:033:1 0 31 >
f544be40 145303835 S Bi:2:033:2 -115 4096 <
f544be40 145304826 C Bi:2:033:2 0 4096 = 20202020 320d0a20 20202073 7349644e 756d6265 72090920 20202033 0d0a2020
f544bac0 145304833 S Bi:2:033:2 -115 13 <
f544bac0 145304952 C Bi:2:033:2 0 13 = 55534253 0f000000 00000000 00
f544bac0 145305040 S Bo:2:033:1 -115 31 = 55534243 10000000 00100000 80000a28 00000000 20000008 00000000 000000
f544bac0 145305826 C Bo:2:033:1 0 31 >
f544be40 145305834 S Bi:2:033:2 -115 4096 <
f544be40 145306826 C Bi:2:033:2 0 4096 = 00000000 00000000 00000000 00000000 00000000 00000000 00000000 00000000
f544bac0 145306834 S Bi:2:033:2 -115 13 <
f544bac0 145306885 C Bi:2:033:2 0 13 = 55534253 10000000 00000000 00
f544bac0 145306902 S Bo:2:033:1 -115 31 = 55534243 11000000 00700000 80000a28 00000000 28000038 00000000 000000
f544bac0 145307076 C Bo:2:033:1 0 31 >
f544be40 145307083 S Bi:2:033:2 -115 4096 <
f57f0540 145307085 S Bi:2:033:2 -115 4096 <
f22d6c40 145307086 S Bi:2:033:2 -115 4096 <
f54556c0 145307087 S Bi:2:033:2 -115 4096 <
f57f0ac0 145307089 S Bi:2:033:2 -115 4096 <
e16cd9c0 145307090 S Bi:2:033:2 -115 4096 <
efec8ec0 145307091 S Bi:2:033:2 -115 4096 <
f544be40 145308951 C Bi:2:033:2 0 4096 = 00000000 00000000 00000000 00000000 00000000 00000000 00000000 00000000
f57f0540 145308953 C Bi:2:033:2 0 4096 = 00000000 00000000 00000000 00000000 00000000 00000000 00000000 00000000
f22d6c40 145308954 C Bi:2:033:2 0 4096 = 00000000 00000000 00000000 00000000 00000000 00000000 00000000 00000000
f54556c0 145308955 C Bi:2:033:2 0 4096 = 00000000 00000000 00000000 00000000 00000000 00000000 00000000 00000000
f57f0ac0 145308956 C Bi:2:033:2 0 4096 = 00000000 00000000 00000000 00000000 00000000 00000000 00000000 00000000
e16cd9c0 145308958 C Bi:2:033:2 0 4096 = 00000000 00000000 00000000 00000000 00000000 00000000 00000000 00000000
efec8ec0 145308959 C Bi:2:033:2 0 4096 = 00000000 00000000 00000000 00000000 00000000 00000000 00000000 00000000
f544bac0 145308965 S Bi:2:033:2 -115 13 <
f544bac0 145309077 C Bi:2:033:2 0 13 = 55534253 11000000 00000000 00
f544bac0 145309095 S Bo:2:033:1 -115 31 = 55534243 12000000 000e0000 80000a28 00003c3f f8000007 00000000 000000
f544bac0 145309826 C Bo:2:033:1 0 31 >
f544be40 145309833 S Bi:2:033:2 -115 3584 <
f544be40 145310827 C Bi:2:033:2 0 3584 = 09202020 205b3130 20302031 355d0d0a 20202020 73636f70 65090920 20202049
f544bac0 145310834 S Bi:2:033:2 -115 13 <
f544bac0 145310885 C Bi:2:033:2 0 13 = 55534253 12000000 00000000 00
f544bac0 145310901 S Bo:2:033:1 -115 31 = 55534243 13000000 00020000 80000a28 00003c3f ff000001 00000000 000000
f544bac0 145311076 C Bo:2:033:1 0 31 >
f544be40 145311083 S Bi:2:033:2 -115 512 <
f544be40 145311825 C Bi:2:033:2 0 512 = 644c696e 6b436f6e 74726f6c 2e546875 6d624d43 50203d20 6a6f696e 743b5c6e
f544bac0 145311832 S Bi:2:033:2 -115 13 <
f544bac0 145311952 C Bi:2:033:2 0 13 = 55534253 13000000 00000000 00
f544bac0 145312015 S Bo:2:033:1 -115 31 = 55534243 14000000 00100000 80000a28 00003c3f c0000008 00000000 000000
f544bac0 145312826 C Bo:2:033:1 0 31 >
f544be40 145312834 S Bi:2:033:2 -115 4096 <
f544be40 145313825 C Bi:2:033:2 0 4096 = 6765436c 61737309 20202020 22417574 6f220d0a 09202020 20446174 614c6f67
f544bac0 145313832 S Bi:2:033:2 -115 13 <
f544bac0 145313952 C Bi:2:033:2 0 13 = 55534253 14000000 00000000 00
f544bac0 145313993 S Bo:2:033:1 -115 31 = 55534243 15000000 00100000 80000a28 00003c3f 00000008 00000000 000000
f544bac0 145314826 C Bo:2:033:1 0 31 >
f544be40 145314833 S Bi:2:033:2 -115 4096 <
f544be40 145315826 C Bi:2:033:2 0 4096 = 2020204c 6162656c 73090920 2020205b 302c2030 5d0d0a09 09202020 20537263
f544bac0 145315833 S Bi:2:033:2 -115 13 <
f544bac0 145315952 C Bi:2:033:2 0 13 = 55534253 15000000 00000000 00
f544bac0 145315996 S Bo:2:033:1 -115 31 = 55534243 16000000 00100000 80000a28 00003c3e 70000008 00000000 000000
f544bac0 145316826 C Bo:2:033:1 0 31 >
f544be40 145316833 S Bi:2:033:2 -115 4096 <
f544be40 145317825 C Bi:2:033:2 0 4096 = 20204461 74614c6f 6767696e 674e616d 654d6f64 65092020 20202253 69676e61
f544bac0 145317832 S Bi:2:033:2 -115 13 <
f544bac0 145317952 C Bi:2:033:2 0 13 = 55534253 16000000 00000000 00
f544bac0 145318017 S Bo:2:033:1 -115 31 = 55534243 17000000 00100000 80000a28 0000001e 38000008 00000000 000000
f544bac0 145318826 C Bo:2:033:1 0 31 >
f544be40 145318834 S Bi:2:033:2 -115 4096 <
f544be40 145319826 C Bi:2:033:2 0 4096 = 4162006f 006f0074 0000000f 00ddffff ffffffff ffffffff ffff0000 ffffffff
f544bac0 145319833 S Bi:2:033:2 -115 13 <
f544bac0 145319952 C Bi:2:033:2 0 13 = 55534253 17000000 00000000 00
f544bac0 145320215 S Bo:2:033:1 -115 31 = 55534243 18000000 00000100 80000a28 00000000 60000080 00000000 000000
f544bac0 145320826 C Bo:2:033:1 0 31 >
f544be40 145320838 S Bi:2:033:2 -115 4096 <
f57f0540 145320840 S Bi:2:033:2 -115 4096 <
f22d6c40 145320841 S Bi:2:033:2 -115 4096 <
f54556c0 145320842 S Bi:2:033:2 -115 4096 <
f57f0ac0 145320843 S Bi:2:033:2 -115 4096 <
e16cd9c0 145320844 S Bi:2:033:2 -115 4096 <
efec8ec0 145320845 S Bi:2:033:2 -115 4096 <
e16028c0 145320846 S Bi:2:033:2 -115 4096 <
e169a9c0 145320847 S Bi:2:033:2 -115 4096 <
f54559c0 145320848 S Bi:2:033:2 -115 4096 <
f6c48240 145320849 S Bi:2:033:2 -115 4096 <
efd1f0c0 145320850 S Bi:2:033:2 -115 4096 <
e169ac40 145320851 S Bi:2:033:2 -115 4096 <
e169a7c0 145320853 S Bi:2:033:2 -115 4096 <
efd1f740 145320854 S Bi:2:033:2 -115 4096 <
f57f08c0 145320855 S Bi:2:033:2 -115 4096 <
f544be40 145323824 C Bi:2:033:2 0 4096 = 00000000 00000000 00000000 00000000 00000000 00000000 00000000 00000000
f57f0540 145323826 C Bi:2:033:2 0 4096 = 00000000 00000000 00000000 00000000 00000000 00000000 00000000 00000000
f22d6c40 145323827 C Bi:2:033:2 0 4096 = 00000000 00000000 00000000 00000000 00000000 00000000 00000000 00000000
f54556c0 145323828 C Bi:2:033:2 0 4096 = 00000000 00000000 00000000 00000000 00000000 00000000 00000000 00000000
f57f0ac0 145323828 C Bi:2:033:2 0 4096 = 00000000 00000000 00000000 00000000 00000000 00000000 00000000 00000000
e16cd9c0 145323829 C Bi:2:033:2 0 4096 = 00000000 00000000 00000000 00000000 00000000 00000000 00000000 00000000
efec8ec0 145323830 C Bi:2:033:2 0 4096 = 00000000 00000000 00000000 00000000 00000000 00000000 00000000 00000000
e16028c0 145323831 C Bi:2:033:2 0 4096 = 00000000 00000000 00000000 00000000 00000000 00000000 00000000 00000000
e169a9c0 145323831 C Bi:2:033:2 0 4096 = 00000000 00000000 00000000 00000000 00000000 00000000 00000000 00000000
f54559c0 145323832 C Bi:2:033:2 0 4096 = 00000000 00000000 00000000 00000000 00000000 00000000 00000000 00000000
f6c48240 145323833 C Bi:2:033:2 0 4096 = 00000000 00000000 00000000 00000000 00000000 00000000 00000000 00000000
efd1f0c0 145323834 C Bi:2:033:2 0 4096 = 00000000 00000000 00000000 00000000 00000000 00000000 00000000 00000000
e169ac40 145324451 C Bi:2:033:2 0 4096 = 00000000 00000000 00000000 00000000 00000000 00000000 00000000 00000000
e169a7c0 145324454 C Bi:2:033:2 0 4096 = 00000000 00000000 00000000 00000000 00000000 00000000 00000000 00000000
efd1f740 145324455 C Bi:2:033:2 0 4096 = 00000000 00000000 00000000 00000000 00000000 00000000 00000000 00000000
f57f08c0 145324456 C Bi:2:033:2 0 4096 = 00000000 00000000 00000000 00000000 00000000 00000000 00000000 00000000
f544bac0 145324464 S Bi:2:033:2 -115 13 <
f544bac0 145324577 C Bi:2:033:2 0 13 = 55534253 18000000 00000000 00
f544bac0 145326928 S Bo:2:033:1 -115 31 = 55534243 19000000 00000000 00000600 00000000 00000000 00000000 000000
f544bac0 145327827 C Bo:2:033:1 0 31 >
f544bac0 145327836 S Bi:2:033:2 -115 13 <
f544bac0 145328826 C Bi:2:033:2 0 13 = 55534253 19000000 00000000 00
f544bac0 145328942 S Bo:2:033:1 -115 31 = 55534243 1a000000 00400000 80000a28 00000000 00000020 00000000 000000
f544bac0 145329825 C Bo:2:033:1 0 31 >
f57f0540 145329834 S Bi:2:033:2 -115 4096 <
f22d6c40 145329835 S Bi:2:033:2 -115 4096 <
f54556c0 145329836 S Bi:2:033:2 -115 4096 <
f57f0ac0 145329838 S Bi:2:033:2 -115 4096 <
f57f0540 145331325 C Bi:2:033:2 0 4096 = eb58904d 53444f53 352e3000 02082600 02000000 00f80000 3f00ff00 00000000
f22d6c40 145331328 C Bi:2:033:2 0 4096 = 00000000 00000000 00000000 00000000 00000000 00000000 00000000 00000000
f54556c0 145331329 C Bi:2:033:2 0 4096 = 00000000 00000000 00000000 00000000 00000000 00000000 00000000 00000000
f57f0ac0 145331330 C Bi:2:033:2 0 4096 = 00000000 00000000 00000000 00000000 00000000 00000000 00000000 00000000
f544bac0 145331337 S Bi:2:033:2 -115 13 <
f544bac0 145331452 C Bi:2:033:2 0 13 = 55534253 1a000000 00000000 00
f544bac0 145331509 S Bo:2:033:1 -115 31 = 55534243 1b000000 00100000 80000a28 00003c3f 80000008 00000000 000000
f544bac0 145331825 C Bo:2:033:1 0 31 >
f57f0540 145331833 S Bi:2:033:2 -115 4096 <
f57f0540 145332825 C Bi:2:033:2 0 4096 = 44495022 0d0a0909 20202020 7d0d0a09 0920207d 0d0a0909 2020426c 6f636b43
f544bac0 145332832 S Bi:2:033:2 -115 13 <
f544bac0 145332951 C Bi:2:033:2 0 13 = 55534253 1b000000 00000000 00
f544bac0 145332995 S Bo:2:033:1 -115 31 = 55534243 1c000000 00100000 80000a28 00003c3f f0000008 00000000 000000
f544bac0 145333825 C Bo:2:033:1 0 31 >
f57f0540 145333832 S Bi:2:033:2 -115 4096 <
f57f0540 145334825 C Bi:2:033:2 0 4096 = 20202020 320d0a20 20202073 7349644e 756d6265 72090920 20202033 0d0a2020
f544bac0 145334834 S Bi:2:033:2 -115 13 <
f544bac0 145334951 C Bi:2:033:2 0 13 = 55534253 1c000000 00000000 00
f544bac0 145335115 S Bo:2:033:1 -115 31 = 55534243 1d000000 00100000 80000a28 00000000 20000008 00000000 000000
f544bac0 145335825 C Bo:2:033:1 0 31 >
f57f0540 145335832 S Bi:2:033:2 -115 4096 <
f57f0540 145336825 C Bi:2:033:2 0 4096 = 00000000 00000000 00000000 00000000 00000000 00000000 00000000 00000000
f544bac0 145336832 S Bi:2:033:2 -115 13 <
f544bac0 145336951 C Bi:2:033:2 0 13 = 55534253 1d000000 00000000 00
f544bac0 145336969 S Bo:2:033:1 -115 31 = 55534243 1e000000 00700000 80000a28 00000000 28000038 00000000 000000
f544bac0 145337825 C Bo:2:033:1 0 31 >
f57f0540 145337834 S Bi:2:033:2 -115 4096 <
f22d6c40 145337835 S Bi:2:033:2 -115 4096 <
f54556c0 145337836 S Bi:2:033:2 -115 4096 <
f57f0ac0 145337837 S Bi:2:033:2 -115 4096 <
e16cd9c0 145337838 S Bi:2:033:2 -115 4096 <
efec8ec0 145337839 S Bi:2:033:2 -115 4096 <
e16028c0 145337840 S Bi:2:033:2 -115 4096 <
f57f0540 145339950 C Bi:2:033:2 0 4096 = 00000000 00000000 00000000 00000000 00000000 00000000 00000000 00000000
f22d6c40 145339952 C Bi:2:033:2 0 4096 = 00000000 00000000 00000000 00000000 00000000 00000000 00000000 00000000
f54556c0 145339954 C Bi:2:033:2 0 4096 = 00000000 00000000 00000000 00000000 00000000 00000000 00000000 00000000
f57f0ac0 145339955 C Bi:2:033:2 0 4096 = 00000000 00000000 00000000 00000000 00000000 00000000 00000000 00000000
e16cd9c0 145339956 C Bi:2:033:2 0 4096 = 00000000 00000000 00000000 00000000 00000000 00000000 00000000 00000000
efec8ec0 145339957 C Bi:2:033:2 0 4096 = 00000000 00000000 00000000 00000000 00000000 00000000 00000000 00000000
e16028c0 145339958 C Bi:2:033:2 0 4096 = 00000000 00000000 00000000 00000000 00000000 00000000 00000000 00000000
f544bac0 145339965 S Bi:2:033:2 -115 13 <
f544bac0 145340075 C Bi:2:033:2 0 13 = 55534253 1e000000 00000000 00
f544bac0 145340513 S Bo:2:033:1 -115 31 = 55534243 1f000000 000e0000 80000a28 00003c3f f8000007 00000000 000000
f544bac0 145340825 C Bo:2:033:1 0 31 >
f57f0540 145340831 S Bi:2:033:2 -115 3584 <
f57f0540 145341825 C Bi:2:033:2 0 3584 = 09202020 205b3130 20302031 355d0d0a 20202020 73636f70 65090920 20202049
f544bac0 145341833 S Bi:2:033:2 -115 13 <
f544bac0 145341951 C Bi:2:033:2 0 13 = 55534253 1f000000 00000000 00
f544bac0 145341969 S Bo:2:033:1 -115 31 = 55534243 20000000 00020000 80000a28 00003c3f ff000001 00000000 000000
f544bac0 145342825 C Bo:2:033:1 0 31 >
f57f0540 145342832 S Bi:2:033:2 -115 512 <
f57f0540 145343825 C Bi:2:033:2 0 512 = 644c696e 6b436f6e 74726f6c 2e546875 6d624d43 50203d20 6a6f696e 743b5c6e
f544bac0 145343831 S Bi:2:033:2 -115 13 <
f544bac0 145343951 C Bi:2:033:2 0 13 = 55534253 20000000 00000000 00
f544bac0 145344022 S Bo:2:033:1 -115 31 = 55534243 21000000 00100000 80000a28 00003c3f c0000008 00000000 000000
f544bac0 145344823 C Bo:2:033:1 0 31 >
f57f0540 145344834 S Bi:2:033:2 -115 4096 <
f57f0540 145345825 C Bi:2:033:2 0 4096 = 6765436c 61737309 20202020 22417574 6f220d0a 09202020 20446174 614c6f67
f544bac0 145345833 S Bi:2:033:2 -115 13 <
f544bac0 145345951 C Bi:2:033:2 0 13 = 55534253 21000000 00000000 00
f544bac0 145345991 S Bo:2:033:1 -115 31 = 55534243 22000000 00100000 80000a28 00003c3f 00000008 00000000 000000
f544bac0 145346825 C Bo:2:033:1 0 31 >
f57f0540 145346832 S Bi:2:033:2 -115 4096 <
f57f0540 145347826 C Bi:2:033:2 0 4096 = 2020204c 6162656c 73090920 2020205b 302c2030 5d0d0a09 09202020 20537263
f544bac0 145347832 S Bi:2:033:2 -115 13 <
f544bac0 145347950 C Bi:2:033:2 0 13 = 55534253 22000000 00000000 00
f544bac0 145347992 S Bo:2:033:1 -115 31 = 55534243 23000000 00100000 80000a28 00003c3e 70000008 00000000 000000
f544bac0 145348825 C Bo:2:033:1 0 31 >
f57f0540 145348833 S Bi:2:033:2 -115 4096 <
f57f0540 145349824 C Bi:2:033:2 0 4096 = 20204461 74614c6f 6767696e 674e616d 654d6f64 65092020 20202253 69676e61
f544bac0 145349831 S Bi:2:033:2 -115 13 <
f544bac0 145349951 C Bi:2:033:2 0 13 = 55534253 23000000 00000000 00
f544bac0 145350019 S Bo:2:033:1 -115 31 = 55534243 24000000 00100000 80000a28 0000001e 38000008 00000000 000000
f544bac0 145350825 C Bo:2:033:1 0 31 >
f57f0540 145350832 S Bi:2:033:2 -115 4096 <
f57f0540 145351824 C Bi:2:033:2 0 4096 = 4162006f 006f0074 0000000f 00ddffff ffffffff ffffffff ffff0000 ffffffff
f544bac0 145351831 S Bi:2:033:2 -115 13 <
f544bac0 145351950 C Bi:2:033:2 0 13 = 55534253 24000000 00000000 00
f544bac0 145352092 S Bo:2:033:1 -115 31 = 55534243 25000000 00100000 80000a28 00000000 60000008 00000000 000000
f544bac0 145352825 C Bo:2:033:1 0 31 >
f57f0540 145352832 S Bi:2:033:2 -115 4096 <
f57f0540 145353824 C Bi:2:033:2 0 4096 = 00000000 00000000 00000000 00000000 00000000 00000000 00000000 00000000
f544bac0 145353831 S Bi:2:033:2 -115 13 <
f544bac0 145353951 C Bi:2:033:2 0 13 = 55534253 25000000 00000000 00
f544bac0 145353969 S Bo:2:033:1 -115 31 = 55534243 26000000 00f00000 80000a28 00000000 68000078 00000000 000000
f544bac0 145354829 C Bo:2:033:1 0 31 >
f57f0540 145354836 S Bi:2:033:2 -115 4096 <
f22d6c40 145354837 S Bi:2:033:2 -115 4096 <
f54556c0 145354838 S Bi:2:033:2 -115 4096 <
f57f0ac0 145354839 S Bi:2:033:2 -115 4096 <
e16cd9c0 145354839 S Bi:2:033:2 -115 4096 <
efec8ec0 145354840 S Bi:2:033:2 -115 4096 <
e16028c0 145354841 S Bi:2:033:2 -115 4096 <
e169a9c0 145354841 S Bi:2:033:2 -115 4096 <
f54559c0 145354842 S Bi:2:033:2 -115 4096 <
f6c48240 145354843 S Bi:2:033:2 -115 4096 <
efd1f0c0 145354844 S Bi:2:033:2 -115 4096 <
e169ac40 145354844 S Bi:2:033:2 -115 4096 <
e169a7c0 145354845 S Bi:2:033:2 -115 4096 <
efd1f740 145354846 S Bi:2:033:2 -115 4096 <
f57f08c0 145354847 S Bi:2:033:2 -115 4096 <
f57f0540 145355883 C Bi:2:033:2 0 4096 = 00000000 00000000 00000000 00000000 00000000 00000000 00000000 00000000
f22d6c40 145358324 C Bi:2:033:2 0 4096 = 00000000 00000000 00000000 00000000 00000000 00000000 00000000 00000000
f54556c0 145358327 C Bi:2:033:2 0 4096 = 00000000 00000000 00000000 00000000 00000000 00000000 00000000 00000000
f57f0ac0 145358328 C Bi:2:033:2 0 4096 = 00000000 00000000 00000000 00000000 00000000 00000000 00000000 00000000
e16cd9c0 145358329 C Bi:2:033:2 0 4096 = 00000000 00000000 00000000 00000000 00000000 00000000 00000000 00000000
efec8ec0 145358330 C Bi:2:033:2 0 4096 = 00000000 00000000 00000000 00000000 00000000 00000000 00000000 00000000
e16028c0 145358331 C Bi:2:033:2 0 4096 = 00000000 00000000 00000000 00000000 00000000 00000000 00000000 00000000
e169a9c0 145358332 C Bi:2:033:2 0 4096 = 00000000 00000000 00000000 00000000 00000000 00000000 00000000 00000000
f54559c0 145358333 C Bi:2:033:2 0 4096 = 00000000 00000000 00000000 00000000 00000000 00000000 00000000 00000000
f6c48240 145358334 C Bi:2:033:2 0 4096 = 00000000 00000000 00000000 00000000 00000000 00000000 00000000 00000000
efd1f0c0 145358335 C Bi:2:033:2 0 4096 = 00000000 00000000 00000000 00000000 00000000 00000000 00000000 00000000
e169ac40 145358337 C Bi:2:033:2 0 4096 = 00000000 00000000 00000000 00000000 00000000 00000000 00000000 00000000
e169a7c0 145358338 C Bi:2:033:2 0 4096 = 00000000 00000000 00000000 00000000 00000000 00000000 00000000 00000000
efd1f740 145358339 C Bi:2:033:2 0 4096 = 00000000 00000000 00000000 00000000 00000000 00000000 00000000 00000000
f57f08c0 145358340 C Bi:2:033:2 0 4096 = 00000000 00000000 00000000 00000000 00000000 00000000 00000000 00000000
f544bac0 145358347 S Bi:2:033:2 -115 13 <
f544bac0 145358450 C Bi:2:033:2 0 13 = 55534253 26000000 00000000 00
f544bac0 145362952 S Bo:2:033:1 -115 31 = 55534243 27000000 00000000 00000600 00000000 00000000 00000000 000000
f544bac0 145363825 C Bo:2:033:1 0 31 >
f544bac0 145363989 S Bi:2:033:2 -115 13 <
f544bac0 145364824 C Bi:2:033:2 0 13 = 55534253 27000000 00000000 00
f544bac0 145365775 S Bo:2:033:1 -115 31 = 55534243 28000000 00400000 80000a28 00000000 00000020 00000000 000000
f544bac0 145366825 C Bo:2:033:1 0 31 >
f544be40 145366836 S Bi:2:033:2 -115 4096 <
f57f0540 145366838 S Bi:2:033:2 -115 4096 <
f22d6c40 145366840 S Bi:2:033:2 -115 4096 <
f54556c0 145366841 S Bi:2:033:2 -115 4096 <
f544be40 145368386 C Bi:2:033:2 0 4096 = eb58904d 53444f53 352e3000 02082600 02000000 00f80000 3f00ff00 00000000
f57f0540 145368389 C Bi:2:033:2 0 4096 = 00000000 00000000 00000000 00000000 00000000 00000000 00000000 00000000
f22d6c40 145368390 C Bi:2:033:2 0 4096 = 00000000 00000000 00000000 00000000 00000000 00000000 00000000 00000000
f54556c0 145368391 C Bi:2:033:2 0 4096 = 00000000 00000000 00000000 00000000 00000000 00000000 00000000 00000000
f544bac0 145368431 S Bi:2:033:2 -115 13 <
f544bac0 145368574 C Bi:2:033:2 0 13 = 55534253 28000000 00000000 00
f544bac0 145368635 S Bo:2:033:1 -115 31 = 55534243 29000000 00100000 80000a28 00003c3f 80000008 00000000 000000
f544bac0 145368824 C Bo:2:033:1 0 31 >
f544be40 145368831 S Bi:2:033:2 -115 4096 <
f544be40 145369824 C Bi:2:033:2 0 4096 = 44495022 0d0a0909 20202020 7d0d0a09 0920207d 0d0a0909 2020426c 6f636b43
f544bac0 145369830 S Bi:2:033:2 -115 13 <
f544bac0 145369950 C Bi:2:033:2 0 13 = 55534253 29000000 00000000 00
f544bac0 145369980 S Bo:2:033:1 -115 31 = 55534243 2a000000 00100000 80000a28 00003c3f f0000008 00000000 000000
f544bac0 145370824 C Bo:2:033:1 0 31 >
f544be40 145370831 S Bi:2:033:2 -115 4096 <
f544be40 145371699 C Bi:2:033:2 0 4096 = 20202020 320d0a20 20202073 7349644e 756d6265 72090920 20202033 0d0a2020
f544bac0 145371706 S Bi:2:033:2 -115 13 <
f544bac0 145371827 C Bi:2:033:2 0 13 = 55534253 2a000000 00000000 00
f544bac0 145371871 S Bo:2:033:1 -115 31 = 55534243 2b000000 00100000 80000a28 00000000 20000008 00000000 000000
f544bac0 145372824 C Bo:2:033:1 0 31 >
f544be40 145372832 S Bi:2:033:2 -115 4096 <
f544be40 145373824 C Bi:2:033:2 0 4096 = 00000000 00000000 00000000 00000000 00000000 00000000 00000000 00000000
f544bac0 145373831 S Bi:2:033:2 -115 13 <
f544bac0 145373950 C Bi:2:033:2 0 13 = 55534253 2b000000 00000000 00
f544bac0 145373970 S Bo:2:033:1 -115 31 = 55534243 2c000000 00700000 80000a28 00000000 28000038 00000000 000000
f544bac0 145374824 C Bo:2:033:1 0 31 >
f544be40 145374833 S Bi:2:033:2 -115 4096 <
f57f0540 145374834 S Bi:2:033:2 -115 4096 <
f22d6c40 145374835 S Bi:2:033:2 -115 4096 <
f54556c0 145374836 S Bi:2:033:2 -115 4096 <
f57f0ac0 145374837 S Bi:2:033:2 -115 4096 <
e16cd9c0 145374838 S Bi:2:033:2 -115 4096 <
efec8ec0 145374840 S Bi:2:033:2 -115 4096 <
f544be40 145376949 C Bi:2:033:2 0 4096 = 00000000 00000000 00000000 00000000 00000000 00000000 00000000 00000000
f57f0540 145376951 C Bi:2:033:2 0 4096 = 00000000 00000000 00000000 00000000 00000000 00000000 00000000 00000000
f22d6c40 145376953 C Bi:2:033:2 0 4096 = 00000000 00000000 00000000 00000000 00000000 00000000 00000000 00000000
f54556c0 145376954 C Bi:2:033:2 0 4096 = 00000000 00000000 00000000 00000000 00000000 00000000 00000000 00000000
f57f0ac0 145376955 C Bi:2:033:2 0 4096 = 00000000 00000000 00000000 00000000 00000000 00000000 00000000 00000000
e16cd9c0 145376956 C Bi:2:033:2 0 4096 = 00000000 00000000 00000000 00000000 00000000 00000000 00000000 00000000
efec8ec0 145376957 C Bi:2:033:2 0 4096 = 00000000 00000000 00000000 00000000 00000000 00000000 00000000 00000000
f544bac0 145376964 S Bi:2:033:2 -115 13 <
f544bac0 145377076 C Bi:2:033:2 0 13 = 55534253 2c000000 00000000 00
f544bac0 145377095 S Bo:2:033:1 -115 31 = 55534243 2d000000 000e0000 80000a28 00003c3f f8000007 00000000 000000
f544bac0 145377824 C Bo:2:033:1 0 31 >
f544be40 145377831 S Bi:2:033:2 -115 3584 <
f544be40 145378824 C Bi:2:033:2 0 3584 = 09202020 205b3130 20302031 355d0d0a 20202020 73636f70 65090920 20202049
f544bac0 145378831 S Bi:2:033:2 -115 13 <
f544bac0 145378950 C Bi:2:033:2 0 13 = 55534253 2d000000 00000000 00
f544bac0 145378966 S Bo:2:033:1 -115 31 = 55534243 2e000000 00020000 80000a28 00003c3f ff000001 00000000 000000
f544bac0 145379824 C Bo:2:033:1 0 31 >
f544be40 145379831 S Bi:2:033:2 -115 512 <
f544be40 145380823 C Bi:2:033:2 0 512 = 644c696e 6b436f6e 74726f6c 2e546875 6d624d43 50203d20 6a6f696e 743b5c6e
f544bac0 145380830 S Bi:2:033:2 -115 13 <
f544bac0 145380950 C Bi:2:033:2 0 13 = 55534253 2e000000 00000000 00
f544bac0 145380998 S Bo:2:033:1 -115 31 = 55534243 2f000000 00100000 80000a28 00003c3f c0000008 00000000 000000
f544bac0 145381824 C Bo:2:033:1 0 31 >
f544be40 145381831 S Bi:2:033:2 -115 4096 <
f544be40 145382823 C Bi:2:033:2 0 4096 = 6765436c 61737309 20202020 22417574 6f220d0a 09202020 20446174 614c6f67
f544bac0 145382830 S Bi:2:033:2 -115 13 <
f544bac0 145382950 C Bi:2:033:2 0 13 = 55534253 2f000000 00000000 00
f544bac0 145382981 S Bo:2:033:1 -115 31 = 55534243 30000000 00100000 80000a28 00003c3f 00000008 00000000 000000
f544bac0 145383824 C Bo:2:033:1 0 31 >
f544be40 145383831 S Bi:2:033:2 -115 4096 <
f544be40 145384824 C Bi:2:033:2 0 4096 = 2020204c 6162656c 73090920 2020205b 302c2030 5d0d0a09 09202020 20537263
f544bac0 145384831 S Bi:2:033:2 -115 13 <
f544bac0 145384950 C Bi:2:033:2 0 13 = 55534253 30000000 00000000 00
f544bac0 145384987 S Bo:2:033:1 -115 31 = 55534243 31000000 00100000 80000a28 00003c3e 70000008 00000000 000000
f544bac0 145385824 C Bo:2:033:1 0 31 >
f544be40 145385831 S Bi:2:033:2 -115 4096 <
f544be40 145386824 C Bi:2:033:2 0 4096 = 20204461 74614c6f 6767696e 674e616d 654d6f64 65092020 20202253 69676e61
f544bac0 145386830 S Bi:2:033:2 -115 13 <
f544bac0 145386950 C Bi:2:033:2 0 13 = 55534253 31000000 00000000 00
f544bac0 145387001 S Bo:2:033:1 -115 31 = 55534243 32000000 00100000 80000a28 0000001e 38000008 00000000 000000
f544bac0 145387823 C Bo:2:033:1 0 31 >
f544be40 145387888 S Bi:2:033:2 -115 4096 <
f544be40 145388823 C Bi:2:033:2 0 4096 = 4162006f 006f0074 0000000f 00ddffff ffffffff ffffffff ffff0000 ffffffff
f544bac0 145388830 S Bi:2:033:2 -115 13 <
f544bac0 145388949 C Bi:2:033:2 0 13 = 55534253 32000000 00000000 00
f544bac0 145389002 S Bo:2:033:1 -115 31 = 55534243 33000000 00100000 80000a28 00000000 60000008 00000000 000000
f544bac0 145389823 C Bo:2:033:1 0 31 >
f544be40 145389831 S Bi:2:033:2 -115 4096 <
f544be40 145390823 C Bi:2:033:2 0 4096 = 00000000 00000000 00000000 00000000 00000000 00000000 00000000 00000000
f544bac0 145390830 S Bi:2:033:2 -115 13 <
f544bac0 145390950 C Bi:2:033:2 0 13 = 55534253 33000000 00000000 00
f544bac0 145390968 S Bo:2:033:1 -115 31 = 55534243 34000000 00f00000 80000a28 00000000 68000078 00000000 000000
f544bac0 145391824 C Bo:2:033:1 0 31 >
f544be40 145391834 S Bi:2:033:2 -115 4096 <
f57f0540 145391836 S Bi:2:033:2 -115 4096 <
f22d6c40 145391837 S Bi:2:033:2 -115 4096 <
f54556c0 145391838 S Bi:2:033:2 -115 4096 <
f57f0ac0 145391839 S Bi:2:033:2 -115 4096 <
e16cd9c0 145391840 S Bi:2:033:2 -115 4096 <
efec8ec0 145391841 S Bi:2:033:2 -115 4096 <
e16028c0 145391842 S Bi:2:033:2 -115 4096 <
e169a9c0 145391844 S Bi:2:033:2 -115 4096 <
f54559c0 145391845 S Bi:2:033:2 -115 4096 <
f6c48240 145391846 S Bi:2:033:2 -115 4096 <
efd1f0c0 145391847 S Bi:2:033:2 -115 4096 <
e169ac40 145391848 S Bi:2:033:2 -115 4096 <
e169a7c0 145391849 S Bi:2:033:2 -115 4096 <
efd1f740 145391850 S Bi:2:033:2 -115 4096 <
f544be40 145395323 C Bi:2:033:2 0 4096 = 00000000 00000000 00000000 00000000 00000000 00000000 00000000 00000000
f57f0540 145395326 C Bi:2:033:2 0 4096 = 00000000 00000000 00000000 00000000 00000000 00000000 00000000 00000000
f22d6c40 145395327 C Bi:2:033:2 0 4096 = 00000000 00000000 00000000 00000000 00000000 00000000 00000000 00000000
f54556c0 145395328 C Bi:2:033:2 0 4096 = 00000000 00000000 00000000 00000000 00000000 00000000 00000000 00000000
f57f0ac0 145395329 C Bi:2:033:2 0 4096 = 00000000 00000000 00000000 00000000 00000000 00000000 00000000 00000000
e16cd9c0 145395330 C Bi:2:033:2 0 4096 = 00000000 00000000 00000000 00000000 00000000 00000000 00000000 00000000
efec8ec0 145395331 C Bi:2:033:2 0 4096 = 00000000 00000000 00000000 00000000 00000000 00000000 00000000 00000000
e16028c0 145395332 C Bi:2:033:2 0 4096 = 00000000 00000000 00000000 00000000 00000000 00000000 00000000 00000000
e169a9c0 145395333 C Bi:2:033:2 0 4096 = 00000000 00000000 00000000 00000000 00000000 00000000 00000000 00000000
f54559c0 145395335 C Bi:2:033:2 0 4096 = 00000000 00000000 00000000 00000000 00000000 00000000 00000000 00000000
f6c48240 145395336 C Bi:2:033:2 0 4096 = 00000000 00000000 00000000 00000000 00000000 00000000 00000000 00000000
efd1f0c0 145395337 C Bi:2:033:2 0 4096 = 00000000 00000000 00000000 00000000 00000000 00000000 00000000 00000000
e169ac40 145395338 C Bi:2:033:2 0 4096 = 00000000 00000000 00000000 00000000 00000000 00000000 00000000 00000000
e169a7c0 145395339 C Bi:2:033:2 0 4096 = 00000000 00000000 00000000 00000000 00000000 00000000 00000000 00000000
efd1f740 145395340 C Bi:2:033:2 0 4096 = 00000000 00000000 00000000 00000000 00000000 00000000 00000000 00000000
f544bac0 145395348 S Bi:2:033:2 -115 13 <
f544bac0 145395447 C Bi:2:033:2 0 13 = 55534253 34000000 00000000 00
f544bac0 145429626 S Bo:2:033:1 -115 31 = 55534243 35000000 00000000 00000600 00000000 00000000 00000000 000000
f544bac0 145429824 C Bo:2:033:1 0 31 >
f544bac0 145429831 S Bi:2:033:2 -115 13 <
f544bac0 145430822 C Bi:2:033:2 0 13 = 55534253 35000000 00000000 00
f544bac0 145430878 S Bo:2:033:1 -115 31 = 55534243 36000000 00020000 80000a28 00000000 00000001 00000000 000000
f544bac0 145431822 C Bo:2:033:1 0 31 >
f544be40 145431830 S Bi:2:033:2 -115 512 <
f544be40 145432822 C Bi:2:033:2 0 512 = eb58904d 53444f53 352e3000 02082600 02000000 00f80000 3f00ff00 00000000
f544bac0 145432829 S Bi:2:033:2 -115 13 <
f544bac0 145432948 C Bi:2:033:2 0 13 = 55534253 36000000 00000000 00
f544bac0 145432977 S Bo:2:033:1 -115 31 = 55534243 37000000 00020000 80000a28 00000000 01000001 00000000 000000
f544bac0 145433823 C Bo:2:033:1 0 31 >
f544be40 145433830 S Bi:2:033:2 -115 512 <
f544be40 145434822 C Bi:2:033:2 0 512 = 52526141 00000000 00000000 00000000 00000000 00000000 00000000 00000000
f544bac0 145434830 S Bi:2:033:2 -115 13 <
f544bac0 145434948 C Bi:2:033:2 0 13 = 55534253 37000000 00000000 00
f544bac0 145435084 S Bo:2:033:1 -115 31 = 55534243 38000000 00020000 80000a28 00000000 26000001 00000000 000000
f544bac0 145435822 C Bo:2:033:1 0 31 >
f544be40 145435830 S Bi:2:033:2 -115 512 <
f544be40 145436823 C Bi:2:033:2 0 512 = f8ffff0f ffffffff ffffff0f 00000000 00000000 00000000 00000000 00000000
f544bac0 145436831 S Bi:2:033:2 -115 13 <
f544bac0 145436948 C Bi:2:033:2 0 13 = 55534253 38000000 00000000 00
f544bac0 145436982 S Bo:2:033:1 -115 31 = 55534243 39000000 00020000 80000a28 0000001e 38000001 00000000 000000
f544bac0 145437822 C Bo:2:033:1 0 31 >
f544be40 145437829 S Bi:2:033:2 -115 512 <
f544be40 145438822 C Bi:2:033:2 0 512 = 4162006f 006f0074 0000000f 00ddffff ffffffff ffffffff ffff0000 ffffffff
f544bac0 145438829 S Bi:2:033:2 -115 13 <
f544bac0 145438948 C Bi:2:033:2 0 13 = 55534253 39000000 00000000 00
f544bac0 145438967 S Bo:2:033:1 -115 31 = 55534243 3a000000 000e0000 80000a28 0000001e 39000007 00000000 000000
f544bac0 145439822 C Bo:2:033:1 0 31 >
f544be40 145439830 S Bi:2:033:2 -115 3584 <
f544be40 145440822 C Bi:2:033:2 0 3584 = 00000000 00000000 00000000 00000000 00000000 00000000 00000000 00000000
f544bac0 145440829 S Bi:2:033:2 -115 13 <
f544bac0 145440948 C Bi:2:033:2 0 13 = 55534253 3a000000 00000000 00
f544bac0 145456522 S Bo:2:033:1 -115 31 = 55534243 3b000000 00000100 80000a28 00000000 27000080 00000000 000000
f544bac0 145456825 C Bo:2:033:1 0 31 >
f544be40 145456838 S Bi:2:033:2 -115 512 <
f57f0540 145456840 S Bi:2:033:2 -115 4096 <
f22d6c40 145456841 S Bi:2:033:2 -115 16384 <
f54556c0 145456842 S Bi:2:033:2 -115 4096 <
f57f0ac0 145456843 S Bi:2:033:2 -115 16384 <
e16cd9c0 145456844 S Bi:2:033:2 -115 16384 <
efec8ec0 145456845 S Bi:2:033:2 -115 7680 <
f544be40 145460698 C Bi:2:033:2 0 512 = 00000000 00000000 00000000 00000000 00000000 00000000 00000000 00000000
f57f0540 145460701 C Bi:2:033:2 0 4096 = 00000000 00000000 00000000 00000000 00000000 00000000 00000000 00000000
f22d6c40 145460702 C Bi:2:033:2 0 16384 = 00000000 00000000 00000000 00000000 00000000 00000000 00000000 00000000
f54556c0 145460703 C Bi:2:033:2 0 4096 = 00000000 00000000 00000000 00000000 00000000 00000000 00000000 00000000
f57f0ac0 145460704 C Bi:2:033:2 0 16384 = 00000000 00000000 00000000 00000000 00000000 00000000 00000000 00000000
e16cd9c0 145460706 C Bi:2:033:2 0 16384 = 00000000 00000000 00000000 00000000 00000000 00000000 00000000 00000000
efec8ec0 145460707 C Bi:2:033:2 0 7680 = 00000000 00000000 00000000 00000000 00000000 00000000 00000000 00000000
f544bac0 145460716 S Bi:2:033:2 -115 13 <
f544bac0 145460824 C Bi:2:033:2 0 13 = 55534253 3b000000 00000000 00
f544bac0 145460896 S Bo:2:033:1 -115 31 = 55534243 3c000000 00fe0000 80000a28 00000000 a700007f 00000000 000000
f544bac0 145461822 C Bo:2:033:1 0 31 >
f57f0540 145461831 S Bi:2:033:2 -115 8704 <
f22d6c40 145461833 S Bi:2:033:2 -115 8192 <
f54556c0 145461834 S Bi:2:033:2 -115 8192 <
f57f0ac0 145461835 S Bi:2:033:2 -115 16384 <
e16cd9c0 145461836 S Bi:2:033:2 -115 16384 <
efec8ec0 145461837 S Bi:2:033:2 -115 7168 <
f57f0540 145464091 C Bi:2:033:2 0 8704 = 00000000 00000000 00000000 00000000 00000000 00000000 00000000 00000000
f22d6c40 145464093 C Bi:2:033:2 0 8192 = 00000000 00000000 00000000 00000000 00000000 00000000 00000000 00000000
f54556c0 145464095 C Bi:2:033:2 0 8192 = 00000000 00000000 00000000 00000000 00000000 00000000 00000000 00000000
f57f0ac0 145465696 C Bi:2:033:2 0 16384 = 00000000 00000000 00000000 00000000 00000000 00000000 00000000 00000000
e16cd9c0 145465698 C Bi:2:033:2 0 16384 = 00000000 00000000 00000000 00000000 00000000 00000000 00000000 00000000
efec8ec0 145465699 C Bi:2:033:2 0 7168 = 00000000 00000000 00000000 00000000 00000000 00000000 00000000 00000000
f544bac0 145465705 S Bi:2:033:2 -115 13 <
f544bac0 145465822 C Bi:2:033:2 0 13 = 55534253 3c000000 00000000 00
f544bac0 145466374 S Bo:2:033:1 -115 31 = 55534243 3d000000 00020000 80000a28 00000001 26000001 00000000 000000
f544bac0 145466821 C Bo:2:033:1 0 31 >
f57f0540 145466829 S Bi:2:033:2 -115 512 <
f57f0540 145467821 C Bi:2:033:2 0 512 = 00000000 00000000 00000000 00000000 00000000 00000000 00000000 00000000
f544bac0 145467828 S Bi:2:033:2 -115 13 <
f544bac0 145467947 C Bi:2:033:2 0 13 = 55534253 3d000000 00000000 00
f544bac0 145467969 S Bo:2:033:1 -115 31 = 55534243 3e000000 00000100 80000a28 00000001 27000080 00000000 000000
f544bac0 145468821 C Bo:2:033:1 0 31 >
f57f0540 145468829 S Bi:2:033:2 -115 8704 <
f22d6c40 145468831 S Bi:2:033:2 -115 16384 <
f54556c0 145468832 S Bi:2:033:2 -115 16384 <
f57f0ac0 145468833 S Bi:2:033:2 -115 16384 <
e16cd9c0 145468834 S Bi:2:033:2 -115 7680 <
f57f0540 145472271 C Bi:2:033:2 0 8704 = 00000000 00000000 00000000 00000000 00000000 00000000 00000000 00000000
f22d6c40 145472273 C Bi:2:033:2 0 16384 = 00000000 00000000 00000000 00000000 00000000 00000000 00000000 00000000
f54556c0 145472274 C Bi:2:033:2 0 16384 = 00000000 00000000 00000000 00000000 00000000 00000000 00000000 00000000
f57f0ac0 145472275 C Bi:2:033:2 0 16384 = 00000000 00000000 00000000 00000000 00000000 00000000 00000000 00000000
e16cd9c0 145472696 C Bi:2:033:2 0 7680 = 00000000 00000000 00000000 00000000 00000000 00000000 00000000 00000000
f544bac0 145472703 S Bi:2:033:2 -115 13 <
f544bac0 145472819 C Bi:2:033:2 0 13 = 55534253 3e000000 00000000 00
f544bac0 145473180 S Bo:2:033:1 -115 31 = 55534243 3f000000 00fe0000 80000a28 00000001 a700007f 00000000 000000
f544bac0 145473821 C Bo:2:033:1 0 31 >
f57f0540 145473830 S Bi:2:033:2 -115 512 <
f22d6c40 145473831 S Bi:2:033:2 -115 8192 <
f54556c0 145473832 S Bi:2:033:2 -115 16384 <
f57f0ac0 145473833 S Bi:2:033:2 -115 16384 <
e16cd9c0 145473835 S Bi:2:033:2 -115 8192 <
efec8ec0 145473836 S Bi:2:033:2 -115 4096 <
e16028c0 145473837 S Bi:2:033:2 -115 4096 <
e169a9c0 145473838 S Bi:2:033:2 -115 4096 <
f54559c0 145473839 S Bi:2:033:2 -115 3072 <
f57f0540 145476250 C Bi:2:033:2 0 512 = 00000000 00000000 00000000 00000000 00000000 00000000 00000000 00000000
f22d6c40 145476252 C Bi:2:033:2 0 8192 = 00000000 00000000 00000000 00000000 00000000 00000000 00000000 00000000
f54556c0 145476253 C Bi:2:033:2 0 16384 = 00000000 00000000 00000000 00000000 00000000 00000000 00000000 00000000
f57f0ac0 145477695 C Bi:2:033:2 0 16384 = 00000000 00000000 00000000 00000000 00000000 00000000 00000000 00000000
e16cd9c0 145477697 C Bi:2:033:2 0 8192 = 00000000 00000000 00000000 00000000 00000000 00000000 00000000 00000000
efec8ec0 145477699 C Bi:2:033:2 0 4096 = 00000000 00000000 00000000 00000000 00000000 00000000 00000000 00000000
e16028c0 145477700 C Bi:2:033:2 0 4096 = 00000000 00000000 00000000 00000000 00000000 00000000 00000000 00000000
e169a9c0 145477701 C Bi:2:033:2 0 4096 = 00000000 00000000 00000000 00000000 00000000 00000000 00000000 00000000
f54559c0 145477702 C Bi:2:033:2 0 3072 = 00000000 00000000 00000000 00000000 00000000 00000000 00000000 00000000
f544bac0 145477707 S Bi:2:033:2 -115 13 <
f544bac0 145477822 C Bi:2:033:2 0 13 = 55534253 3f000000 00000000 00
f544bac0 145478397 S Bo:2:033:1 -115 31 = 55534243 40000000 00020000 80000a28 00000002 26000001 00000000 000000
f544bac0 145478821 C Bo:2:033:1 0 31 >
f57f0540 145478829 S Bi:2:033:2 -115 512 <
f57f0540 145479820 C Bi:2:033:2 0 512 = 00000000 00000000 00000000 00000000 00000000 00000000 00000000 00000000
f544bac0 145479827 S Bi:2:033:2 -115 13 <
f544bac0 145479947 C Bi:2:033:2 0 13 = 55534253 40000000 00000000 00
f544bac0 145479971 S Bo:2:033:1 -115 31 = 55534243 41000000 00000100 80000a28 00000002 27000080 00000000 000000
f544bac0 145480821 C Bo:2:033:1 0 31 >
f57f0540 145480832 S Bi:2:033:2 -115 512 <
f22d6c40 145480833 S Bi:2:033:2 -115 4096 <
f54556c0 145480834 S Bi:2:033:2 -115 4096 <
f57f0ac0 145480835 S Bi:2:033:2 -115 4096 <
e16cd9c0 145480837 S Bi:2:033:2 -115 4096 <
efec8ec0 145480838 S Bi:2:033:2 -115 4096 <
e16028c0 145480839 S Bi:2:033:2 -115 4096 <
e169a9c0 145480840 S Bi:2:033:2 -115 4096 <
f54559c0 145480841 S Bi:2:033:2 -115 4096 <
f6c48240 145480842 S Bi:2:033:2 -115 4096 <
efd1f0c0 145480843 S Bi:2:033:2 -115 4096 <
e169ac40 145480844 S Bi:2:033:2 -115 4096 <
e169a7c0 145480845 S Bi:2:033:2 -115 4096 <
efd1f740 145480846 S Bi:2:033:2 -115 4096 <
f57f08c0 145480847 S Bi:2:033:2 -115 4096 <
f573a1c0 145480848 S Bi:2:033:2 -115 4096 <
e169a440 145480849 S Bi:2:033:2 -115 3584 <
f57f0540 145483973 C Bi:2:033:2 0 512 = 00000000 00000000 00000000 00000000 00000000 00000000 00000000 00000000
f22d6c40 145483975 C Bi:2:033:2 0 4096 = 00000000 00000000 00000000 00000000 00000000 00000000 00000000 00000000
f54556c0 145483976 C Bi:2:033:2 0 4096 = 00000000 00000000 00000000 00000000 00000000 00000000 00000000 00000000
f57f0ac0 145483977 C Bi:2:033:2 0 4096 = 00000000 00000000 00000000 00000000 00000000 00000000 00000000 00000000
e16cd9c0 145483978 C Bi:2:033:2 0 4096 = 00000000 00000000 00000000 00000000 00000000 00000000 00000000 00000000
efec8ec0 145483980 C Bi:2:033:2 0 4096 = 00000000 00000000 00000000 00000000 00000000 00000000 00000000 00000000
e16028c0 145483981 C Bi:2:033:2 0 4096 = 00000000 00000000 00000000 00000000 00000000 00000000 00000000 00000000
e169a9c0 145483982 C Bi:2:033:2 0 4096 = 00000000 00000000 00000000 00000000 00000000 00000000 00000000 00000000
f54559c0 145483983 C Bi:2:033:2 0 4096 = 00000000 00000000 00000000 00000000 00000000 00000000 00000000 00000000
f6c48240 145483984 C Bi:2:033:2 0 4096 = 00000000 00000000 00000000 00000000 00000000 00000000 00000000 00000000
efd1f0c0 145483985 C Bi:2:033:2 0 4096 = 00000000 00000000 00000000 00000000 00000000 00000000 00000000 00000000
e169ac40 145483986 C Bi:2:033:2 0 4096 = 00000000 00000000 00000000 00000000 00000000 00000000 00000000 00000000
e169a7c0 145483987 C Bi:2:033:2 0 4096 = 00000000 00000000 00000000 00000000 00000000 00000000 00000000 00000000
efd1f740 145484695 C Bi:2:033:2 0 4096 = 00000000 00000000 00000000 00000000 00000000 00000000 00000000 00000000
f57f08c0 145484697 C Bi:2:033:2 0 4096 = 00000000 00000000 00000000 00000000 00000000 00000000 00000000 00000000
f573a1c0 145484698 C Bi:2:033:2 0 4096 = 00000000 00000000 00000000 00000000 00000000 00000000 00000000 00000000
e169a440 145484700 C Bi:2:033:2 0 3584 = 00000000 00000000 00000000 00000000 00000000 00000000 00000000 00000000
f544bac0 145484706 S Bi:2:033:2 -115 13 <
f544bac0 145484821 C Bi:2:033:2 0 13 = 55534253 41000000 00000000 00
f544bac0 145484871 S Bo:2:033:1 -115 31 = 55534243 42000000 00fe0000 80000a28 00000002 a700007f 00000000 000000
f544bac0 145485820 C Bo:2:033:1 0 31 >
f57f0540 145485831 S Bi:2:033:2 -115 512 <
f22d6c40 145485833 S Bi:2:033:2 -115 4096 <
f54556c0 145485834 S Bi:2:033:2 -115 4096 <
f57f0ac0 145485835 S Bi:2:033:2 -115 4096 <
e16cd9c0 145485836 S Bi:2:033:2 -115 4096 <
efec8ec0 145485837 S Bi:2:033:2 -115 4096 <
e16028c0 145485838 S Bi:2:033:2 -115 4096 <
e169a9c0 145485839 S Bi:2:033:2 -115 4096 <
f54559c0 145485840 S Bi:2:033:2 -115 4096 <
f6c48240 145485841 S Bi:2:033:2 -115 4096 <
efd1f0c0 145485842 S Bi:2:033:2 -115 4096 <
e169ac40 145485843 S Bi:2:033:2 -115 4096 <
e169a7c0 145485844 S Bi:2:033:2 -115 4096 <
efd1f740 145485845 S Bi:2:033:2 -115 4096 <
f57f08c0 145485847 S Bi:2:033:2 -115 4096 <
f573a1c0 145485848 S Bi:2:033:2 -115 4096 <
e169a440 145485849 S Bi:2:033:2 -115 3072 <
f57f0540 145488230 C Bi:2:033:2 0 512 = 00000000 00000000 00000000 00000000 00000000 00000000 00000000 00000000
f22d6c40 145488232 C Bi:2:033:2 0 4096 = 00000000 00000000 00000000 00000000 00000000 00000000 00000000 00000000
f54556c0 145488232 C Bi:2:033:2 0 4096 = 00000000 00000000 00000000 00000000 00000000 00000000 00000000 00000000
f57f0ac0 145488233 C Bi:2:033:2 0 4096 = 00000000 00000000 00000000 00000000 00000000 00000000 00000000 00000000
e16cd9c0 145488234 C Bi:2:033:2 0 4096 = 00000000 00000000 00000000 00000000 00000000 00000000 00000000 00000000
efec8ec0 145488235 C Bi:2:033:2 0 4096 = 00000000 00000000 00000000 00000000 00000000 00000000 00000000 00000000
e16028c0 145488235 C Bi:2:033:2 0 4096 = 00000000 00000000 00000000 00000000 00000000 00000000 00000000 00000000
e169a9c0 145488236 C Bi:2:033:2 0 4096 = 00000000 00000000 00000000 00000000 00000000 00000000 00000000 00000000
f54559c0 145488237 C Bi:2:033:2 0 4096 = 00000000 00000000 00000000 00000000 00000000 00000000 00000000 00000000
f6c48240 145489695 C Bi:2:033:2 0 4096 = 00000000 00000000 00000000 00000000 00000000 00000000 00000000 00000000
efd1f0c0 145489698 C Bi:2:033:2 0 4096 = 00000000 00000000 00000000 00000000 00000000 00000000 00000000 00000000
e169ac40 145489699 C Bi:2:033:2 0 4096 = 00000000 00000000 00000000 00000000 00000000 00000000 00000000 00000000
e169a7c0 145489700 C Bi:2:033:2 0 4096 = 00000000 00000000 00000000 00000000 00000000 00000000 00000000 00000000
efd1f740 145489701 C Bi:2:033:2 0 4096 = 00000000 00000000 00000000 00000000 00000000 00000000 00000000 00000000
f57f08c0 145489702 C Bi:2:033:2 0 4096 = 00000000 00000000 00000000 00000000 00000000 00000000 00000000 00000000
f573a1c0 145489703 C Bi:2:033:2 0 4096 = 00000000 00000000 00000000 00000000 00000000 00000000 00000000 00000000
e169a440 145489704 C Bi:2:033:2 0 3072 = 00000000 00000000 00000000 00000000 00000000 00000000 00000000 00000000
f544bac0 145489711 S Bi:2:033:2 -115 13 <
f544bac0 145489821 C Bi:2:033:2 0 13 = 55534253 42000000 00000000 00
f544bac0 145490349 S Bo:2:033:1 -115 31 = 55534243 43000000 00020000 80000a28 00000003 26000001 00000000 000000
f544bac0 145490820 C Bo:2:033:1 0 31 >
f57f0540 145490828 S Bi:2:033:2 -115 512 <
f57f0540 145491820 C Bi:2:033:2 0 512 = 00000000 00000000 00000000 00000000 00000000 00000000 00000000 00000000
f544bac0 145491827 S Bi:2:033:2 -115 13 <
f544bac0 145491946 C Bi:2:033:2 0 13 = 55534253 43000000 00000000 00
f544bac0 145491968 S Bo:2:033:1 -115 31 = 55534243 44000000 00000100 80000a28 00000003 27000080 00000000 000000
f544bac0 145492820 C Bo:2:033:1 0 31 >
f57f0540 145492831 S Bi:2:033:2 -115 512 <
f22d6c40 145492832 S Bi:2:033:2 -115 4096 <
f54556c0 145492833 S Bi:2:033:2 -115 4096 <
f57f0ac0 145492834 S Bi:2:033:2 -115 4096 <
e16cd9c0 145492835 S Bi:2:033:2 -115 4096 <
efec8ec0 145492836 S Bi:2:033:2 -115 4096 <
e16028c0 145492837 S Bi:2:033:2 -115 4096 <
e169a9c0 145492839 S Bi:2:033:2 -115 4096 <
f54559c0 145492840 S Bi:2:033:2 -115 4096 <
f6c48240 145492841 S Bi:2:033:2 -115 4096 <
efd1f0c0 145492842 S Bi:2:033:2 -115 4096 <
e169ac40 145492843 S Bi:2:033:2 -115 4096 <
e169a7c0 145492844 S Bi:2:033:2 -115 4096 <
efd1f740 145492845 S Bi:2:033:2 -115 4096 <
f57f08c0 145492846 S Bi:2:033:2 -115 4096 <
f573a1c0 145492847 S Bi:2:033:2 -115 4096 <
e169a440 145492848 S Bi:2:033:2 -115 3584 <
f57f0540 145496250 C Bi:2:033:2 0 512 = 00000000 00000000 00000000 00000000 00000000 00000000 00000000 00000000
f22d6c40 145496252 C Bi:2:033:2 0 4096 = 00000000 00000000 00000000 00000000 00000000 00000000 00000000 00000000
f54556c0 145496253 C Bi:2:033:2 0 4096 = 00000000 00000000 00000000 00000000 00000000 00000000 00000000 00000000
f57f0ac0 145496254 C Bi:2:033:2 0 4096 = 00000000 00000000 00000000 00000000 00000000 00000000 00000000 00000000
e16cd9c0 145496255 C Bi:2:033:2 0 4096 = 00000000 00000000 00000000 00000000 00000000 00000000 00000000 00000000
efec8ec0 145496256 C Bi:2:033:2 0 4096 = 00000000 00000000 00000000 00000000 00000000 00000000 00000000 00000000
e16028c0 145496257 C Bi:2:033:2 0 4096 = 00000000 00000000 00000000 00000000 00000000 00000000 00000000 00000000
e169a9c0 145496258 C Bi:2:033:2 0 4096 = 00000000 00000000 00000000 00000000 00000000 00000000 00000000 00000000
f54559c0 145496259 C Bi:2:033:2 0 4096 = 00000000 00000000 00000000 00000000 00000000 00000000 00000000 00000000
f6c48240 145496261 C Bi:2:033:2 0 4096 = 00000000 00000000 00000000 00000000 00000000 00000000 00000000 00000000
efd1f0c0 145496262 C Bi:2:033:2 0 4096 = 00000000 00000000 00000000 00000000 00000000 00000000 00000000 00000000
e169ac40 145496263 C Bi:2:033:2 0 4096 = 00000000 00000000 00000000 00000000 00000000 00000000 00000000 00000000
e169a7c0 145496264 C Bi:2:033:2 0 4096 = 00000000 00000000 00000000 00000000 00000000 00000000 00000000 00000000
efd1f740 145496265 C Bi:2:033:2 0 4096 = 00000000 00000000 00000000 00000000 00000000 00000000 00000000 00000000
f57f08c0 145496266 C Bi:2:033:2 0 4096 = 00000000 00000000 00000000 00000000 00000000 00000000 00000000 00000000
f573a1c0 145496696 C Bi:2:033:2 0 4096 = 00000000 00000000 00000000 00000000 00000000 00000000 00000000 00000000
e169a440 145496698 C Bi:2:033:2 0 3584 = 00000000 00000000 00000000 00000000 00000000 00000000 00000000 00000000
f544bac0 145496705 S Bi:2:033:2 -115 13 <
f544bac0 145496821 C Bi:2:033:2 0 13 = 55534253 44000000 00000000 00
f544bac0 145496872 S Bo:2:033:1 -115 31 = 55534243 45000000 00fe0000 80000a28 00000003 a700007f 00000000 000000
f544bac0 145497820 C Bo:2:033:1 0 31 >
f57f0540 145498021 S Bi:2:033:2 -115 512 <
f22d6c40 145498022 S Bi:2:033:2 -115 4096 <
f54556c0 145498023 S Bi:2:033:2 -115 4096 <
f57f0ac0 145498024 S Bi:2:033:2 -115 4096 <
e16cd9c0 145498025 S Bi:2:033:2 -115 4096 <
efec8ec0 145498025 S Bi:2:033:2 -115 4096 <
e16028c0 145498026 S Bi:2:033:2 -115 4096 <
e169a9c0 145498027 S Bi:2:033:2 -115 4096 <
f54559c0 145498027 S Bi:2:033:2 -115 4096 <
f6c48240 145498028 S Bi:2:033:2 -115 4096 <
efd1f0c0 145498028 S Bi:2:033:2 -115 4096 <
e169ac40 145498029 S Bi:2:033:2 -115 4096 <
e169a7c0 145498030 S Bi:2:033:2 -115 4096 <
efd1f740 145498030 S Bi:2:033:2 -115 4096 <
f57f08c0 145498031 S Bi:2:033:2 -115 4096 <
f573a1c0 145498032 S Bi:2:033:2 -115 4096 <
e169a440 145498032 S Bi:2:033:2 -115 3072 <
f57f0540 145501704 C Bi:2:033:2 0 512 = 00000000 00000000 00000000 00000000 00000000 00000000 00000000 00000000
f22d6c40 145501707 C Bi:2:033:2 0 4096 = 00000000 00000000 00000000 00000000 00000000 00000000 00000000 00000000
f54556c0 145501708 C Bi:2:033:2 0 4096 = 00000000 00000000 00000000 00000000 00000000 00000000 00000000 00000000
f57f0ac0 145501709 C Bi:2:033:2 0 4096 = 00000000 00000000 00000000 00000000 00000000 00000000 00000000 00000000
e16cd9c0 145501710 C Bi:2:033:2 0 4096 = 00000000 00000000 00000000 00000000 00000000 00000000 00000000 00000000
efec8ec0 145501711 C Bi:2:033:2 0 4096 = 00000000 00000000 00000000 00000000 00000000 00000000 00000000 00000000
e16028c0 145501712 C Bi:2:033:2 0 4096 = 00000000 00000000 00000000 00000000 00000000 00000000 00000000 00000000
e169a9c0 145501713 C Bi:2:033:2 0 4096 = 00000000 00000000 00000000 00000000 00000000 00000000 00000000 00000000
f54559c0 145501715 C Bi:2:033:2 0 4096 = 00000000 00000000 00000000 00000000 00000000 00000000 00000000 00000000
f6c48240 145501716 C Bi:2:033:2 0 4096 = 00000000 00000000 00000000 00000000 00000000 00000000 00000000 00000000
efd1f0c0 145501717 C Bi:2:033:2 0 4096 = 00000000 00000000 00000000 00000000 00000000 00000000 00000000 00000000
e169ac40 145501718 C Bi:2:033:2 0 4096 = 00000000 00000000 00000000 00000000 00000000 00000000 00000000 00000000
e169a7c0 145501719 C Bi:2:033:2 0 4096 = 00000000 00000000 00000000 00000000 00000000 00000000 00000000 00000000
efd1f740 145501720 C Bi:2:033:2 0 4096 = 00000000 00000000 00000000 00000000 00000000 00000000 00000000 00000000
f57f08c0 145501721 C Bi:2:033:2 0 4096 = 00000000 00000000 00000000 00000000 00000000 00000000 00000000 00000000
f573a1c0 145501722 C Bi:2:033:2 0 4096 = 00000000 00000000 00000000 00000000 00000000 00000000 00000000 00000000
e169a440 145501723 C Bi:2:033:2 0 3072 = 00000000 00000000 00000000 00000000 00000000 00000000 00000000 00000000
f544bac0 145501766 S Bi:2:033:2 -115 13 <
f544bac0 145501820 C Bi:2:033:2 0 13 = 55534253 45000000 00000000 00
f544bac0 145502286 S Bo:2:033:1 -115 31 = 55534243 46000000 00020000 80000a28 00000004 26000001 00000000 000000
f544bac0 145502820 C Bo:2:033:1 0 31 >
f57f0540 145502828 S Bi:2:033:2 -115 512 <
f57f0540 145503820 C Bi:2:033:2 0 512 = 00000000 00000000 00000000 00000000 00000000 00000000 00000000 00000000
f544bac0 145503827 S Bi:2:033:2 -115 13 <
f544bac0 145503945 C Bi:2:033:2 0 13 = 55534253 46000000 00000000 00
f544bac0 145508870 S Bo:2:033:1 -115 31 = 55534243 47000000 00000100 80000a28 00000004 27000080 00000000 000000
f544bac0 145508945 C Bo:2:033:1 0 31 >
f57f0540 145508956 S Bi:2:033:2 -115 512 <
f22d6c40 145508959 S Bi:2:033:2 -115 4096 <
f54556c0 145508960 S Bi:2:033:2 -115 4096 <
f57f0ac0 145508961 S Bi:2:033:2 -115 4096 <
e16cd9c0 145508962 S Bi:2:033:2 -115 4096 <
efec8ec0 145508963 S Bi:2:033:2 -115 4096 <
e16028c0 145508964 S Bi:2:033:2 -115 4096 <
e169a9c0 145508965 S Bi:2:033:2 -115 4096 <
f54559c0 145508966 S Bi:2:033:2 -115 4096 <
f6c48240 145508967 S Bi:2:033:2 -115 4096 <
efd1f0c0 145508968 S Bi:2:033:2 -115 4096 <
e169ac40 145508969 S Bi:2:033:2 -115 4096 <
e169a7c0 145508970 S Bi:2:033:2 -115 4096 <
efd1f740 145508971 S Bi:2:033:2 -115 4096 <
f57f08c0 145508972 S Bi:2:033:2 -115 4096 <
f573a1c0 145508974 S Bi:2:033:2 -115 4096 <
e169a440 145508975 S Bi:2:033:2 -115 3584 <
f57f0540 145512695 C Bi:2:033:2 0 512 = 00000000 00000000 00000000 00000000 00000000 00000000 00000000 00000000
f22d6c40 145512697 C Bi:2:033:2 0 4096 = 00000000 00000000 00000000 00000000 00000000 00000000 00000000 00000000
f54556c0 145512698 C Bi:2:033:2 0 4096 = 00000000 00000000 00000000 00000000 00000000 00000000 00000000 00000000
f57f0ac0 145512699 C Bi:2:033:2 0 4096 = 00000000 00000000 00000000 00000000 00000000 00000000 00000000 00000000
e16cd9c0 145512701 C Bi:2:033:2 0 4096 = 00000000 00000000 00000000 00000000 00000000 00000000 00000000 00000000
efec8ec0 145512701 C Bi:2:033:2 0 4096 = 00000000 00000000 00000000 00000000 00000000 00000000 00000000 00000000
e16028c0 145512703 C Bi:2:033:2 0 4096 = 00000000 00000000 00000000 00000000 00000000 00000000 00000000 00000000
e169a9c0 145512704 C Bi:2:033:2 0 4096 = 00000000 00000000 00000000 00000000 00000000 00000000 00000000 00000000
f54559c0 145512705 C Bi:2:033:2 0 4096 = 00000000 00000000 00000000 00000000 00000000 00000000 00000000 00000000
f6c48240 145512706 C Bi:2:033:2 0 4096 = 00000000 00000000 00000000 00000000 00000000 00000000 00000000 00000000
efd1f0c0 145512707 C Bi:2:033:2 0 4096 = 00000000 00000000 00000000 00000000 00000000 00000000 00000000 00000000
e169ac40 145512708 C Bi:2:033:2 0 4096 = 00000000 00000000 00000000 00000000 00000000 00000000 00000000 00000000
e169a7c0 145512709 C Bi:2:033:2 0 4096 = 00000000 00000000 00000000 00000000 00000000 00000000 00000000 00000000
efd1f740 145512710 C Bi:2:033:2 0 4096 = 00000000 00000000 00000000 00000000 00000000 00000000 00000000 00000000
f57f08c0 145512711 C Bi:2:033:2 0 4096 = 00000000 00000000 00000000 00000000 00000000 00000000 00000000 00000000
f573a1c0 145512712 C Bi:2:033:2 0 4096 = 00000000 00000000 00000000 00000000 00000000 00000000 00000000 00000000
e169a440 145512713 C Bi:2:033:2 0 3584 = 00000000 00000000 00000000 00000000 00000000 00000000 00000000 00000000
f544bac0 145512721 S Bi:2:033:2 -115 13 <
f544bac0 145512819 C Bi:2:033:2 0 13 = 55534253 47000000 00000000 00
f544bac0 145512880 S Bo:2:033:1 -115 31 = 55534243 48000000 00fe0000 80000a28 00000004 a700007f 00000000 000000
f544bac0 145513820 C Bo:2:033:1 0 31 >
f57f0540 145513831 S Bi:2:033:2 -115 512 <
f22d6c40 145513832 S Bi:2:033:2 -115 4096 <
f54556c0 145513833 S Bi:2:033:2 -115 4096 <
f57f0ac0 145513834 S Bi:2:033:2 -115 4096 <
e16cd9c0 145513835 S Bi:2:033:2 -115 4096 <
efec8ec0 145513836 S Bi:2:033:2 -115 4096 <
e16028c0 145513837 S Bi:2:033:2 -115 4096 <
e169a9c0 145513838 S Bi:2:033:2 -115 4096 <
f54559c0 145513839 S Bi:2:033:2 -115 4096 <
f6c48240 145513840 S Bi:2:033:2 -115 4096 <
efd1f0c0 145513842 S Bi:2:033:2 -115 4096 <
e169ac40 145513843 S Bi:2:033:2 -115 4096 <
e169a7c0 145513844 S Bi:2:033:2 -115 4096 <
efd1f740 145513845 S Bi:2:033:2 -115 4096 <
f57f08c0 145513846 S Bi:2:033:2 -115 4096 <
f573a1c0 145513847 S Bi:2:033:2 -115 4096 <
e169a440 145513848 S Bi:2:033:2 -115 3072 <
f57f0540 145515818 C Bi:2:033:2 0 512 = 00000000 00000000 00000000 00000000 00000000 00000000 00000000 00000000
f22d6c40 145515819 C Bi:2:033:2 0 4096 = 00000000 00000000 00000000 00000000 00000000 00000000 00000000 00000000
f54556c0 145515820 C Bi:2:033:2 0 4096 = 00000000 00000000 00000000 00000000 00000000 00000000 00000000 00000000
f57f0ac0 145515820 C Bi:2:033:2 0 4096 = 00000000 00000000 00000000 00000000 00000000 00000000 00000000 00000000
e16cd9c0 145515821 C Bi:2:033:2 0 4096 = 00000000 00000000 00000000 00000000 00000000 00000000 00000000 00000000
efec8ec0 145515822 C Bi:2:033:2 0 4096 = 00000000 00000000 00000000 00000000 00000000 00000000 00000000 00000000
e16028c0 145515823 C Bi:2:033:2 0 4096 = 00000000 00000000 00000000 00000000 00000000 00000000 00000000 00000000
e169a9c0 145517695 C Bi:2:033:2 0 4096 = 00000000 00000000 00000000 00000000 00000000 00000000 00000000 00000000
f54559c0 145517697 C Bi:2:033:2 0 4096 = 00000000 00000000 00000000 00000000 00000000 00000000 00000000 00000000
f6c48240 145517698 C Bi:2:033:2 0 4096 = 00000000 00000000 00000000 00000000 00000000 00000000 00000000 00000000
efd1f0c0 145517699 C Bi:2:033:2 0 4096 = 00000000 00000000 00000000 00000000 00000000 00000000 00000000 00000000
e169ac40 145517700 C Bi:2:033:2 0 4096 = 00000000 00000000 00000000 00000000 00000000 00000000 00000000 00000000
e169a7c0 145517701 C Bi:2:033:2 0 4096 = 00000000 00000000 00000000 00000000 00000000 00000000 00000000 00000000
efd1f740 145517702 C Bi:2:033:2 0 4096 = 00000000 00000000 00000000 00000000 00000000 00000000 00000000 00000000
f57f08c0 145517703 C Bi:2:033:2 0 4096 = 00000000 00000000 00000000 00000000 00000000 00000000 00000000 00000000
f573a1c0 145517704 C Bi:2:033:2 0 4096 = 00000000 00000000 00000000 00000000 00000000 00000000 00000000 00000000
e169a440 145517705 C Bi:2:033:2 0 3072 = 00000000 00000000 00000000 00000000 00000000 00000000 00000000 00000000
f544bac0 145517712 S Bi:2:033:2 -115 13 <
f544bac0 145517821 C Bi:2:033:2 0 13 = 55534253 48000000 00000000 00
f544bac0 145518412 S Bo:2:033:1 -115 31 = 55534243 49000000 00020000 80000a28 00000005 26000001 00000000 000000
f544bac0 145518820 C Bo:2:033:1 0 31 >
f57f0540 145518828 S Bi:2:033:2 -115 512 <
f57f0540 145519819 C Bi:2:033:2 0 512 = 00000000 00000000 00000000 00000000 00000000 00000000 00000000 00000000
f544bac0 145519827 S Bi:2:033:2 -115 13 <
f544bac0 145519945 C Bi:2:033:2 0 13 = 55534253 49000000 00000000 00
f544bac0 145519969 S Bo:2:033:1 -115 31 = 55534243 4a000000 00000100 80000a28 00000005 27000080 00000000 000000
f544bac0 145520820 C Bo:2:033:1 0 31 >
f57f0540 145520830 S Bi:2:033:2 -115 512 <
f22d6c40 145520832 S Bi:2:033:2 -115 4096 <
f54556c0 145520833 S Bi:2:033:2 -115 4096 <
f57f0ac0 145520834 S Bi:2:033:2 -115 4096 <
e16cd9c0 145520835 S Bi:2:033:2 -115 4096 <
efec8ec0 145520836 S Bi:2:033:2 -115 4096 <
e16028c0 145520837 S Bi:2:033:2 -115 4096 <
e169a9c0 145520838 S Bi:2:033:2 -115 4096 <
f54559c0 145520839 S Bi:2:033:2 -115 4096 <
f6c48240 145520840 S Bi:2:033:2 -115 4096 <
efd1f0c0 145520841 S Bi:2:033:2 -115 4096 <
e169ac40 145520842 S Bi:2:033:2 -115 4096 <
e169a7c0 145520843 S Bi:2:033:2 -115 4096 <
efd1f740 145520844 S Bi:2:033:2 -115 4096 <
f57f08c0 145520845 S Bi:2:033:2 -115 4096 <
f573a1c0 145520846 S Bi:2:033:2 -115 4096 <
e169a440 145520847 S Bi:2:033:2 -115 3584 <
f57f0540 145523743 C Bi:2:033:2 0 512 = 00000000 00000000 00000000 00000000 00000000 00000000 00000000 00000000
f22d6c40 145523745 C Bi:2:033:2 0 4096 = 00000000 00000000 00000000 00000000 00000000 00000000 00000000 00000000
f54556c0 145523746 C Bi:2:033:2 0 4096 = 00000000 00000000 00000000 00000000 00000000 00000000 00000000 00000000
f57f0ac0 145523747 C Bi:2:033:2 0 4096 = 00000000 00000000 00000000 00000000 00000000 00000000 00000000 00000000
e16cd9c0 145523748 C Bi:2:033:2 0 4096 = 00000000 00000000 00000000 00000000 00000000 00000000 00000000 00000000
efec8ec0 145523749 C Bi:2:033:2 0 4096 = 00000000 00000000 00000000 00000000 00000000 00000000 00000000 00000000
e16028c0 145523750 C Bi:2:033:2 0 4096 = 00000000 00000000 00000000 00000000 00000000 00000000 00000000 00000000
e169a9c0 145523751 C Bi:2:033:2 0 4096 = 00000000 00000000 00000000 00000000 00000000 00000000 00000000 00000000
f54559c0 145523752 C Bi:2:033:2 0 4096 = 00000000 00000000 00000000 00000000 00000000 00000000 00000000 00000000
f6c48240 145523754 C Bi:2:033:2 0 4096 = 00000000 00000000 00000000 00000000 00000000 00000000 00000000 00000000
efd1f0c0 145523755 C Bi:2:033:2 0 4096 = 00000000 00000000 00000000 00000000 00000000 00000000 00000000 00000000
e169ac40 145523756 C Bi:2:033:2 0 4096 = 00000000 00000000 00000000 00000000 00000000 00000000 00000000 00000000
e169a7c0 145524694 C Bi:2:033:2 0 4096 = 00000000 00000000 00000000 00000000 00000000 00000000 00000000 00000000
efd1f740 145524696 C Bi:2:033:2 0 4096 = 00000000 00000000 00000000 00000000 00000000 00000000 00000000 00000000
f57f08c0 145524697 C Bi:2:033:2 0 4096 = 00000000 00000000 00000000 00000000 00000000 00000000 00000000 00000000
f573a1c0 145524698 C Bi:2:033:2 0 4096 = 00000000 00000000 00000000 00000000 00000000 00000000 00000000 00000000
e169a440 145524699 C Bi:2:033:2 0 3584 = 00000000 00000000 00000000 00000000 00000000 00000000 00000000 00000000
f544bac0 145524706 S Bi:2:033:2 -115 13 <
f544bac0 145524820 C Bi:2:033:2 0 13 = 55534253 4a000000 00000000 00
f544bac0 145524871 S Bo:2:033:1 -115 31 = 55534243 4b000000 00fe0000 80000a28 00000005 a700007f 00000000 000000
f544bac0 145525819 C Bo:2:033:1 0 31 >
f57f0540 145525830 S Bi:2:033:2 -115 512 <
f22d6c40 145525831 S Bi:2:033:2 -115 4096 <
f54556c0 145525832 S Bi:2:033:2 -115 4096 <
f57f0ac0 145525833 S Bi:2:033:2 -115 4096 <
e16cd9c0 145525834 S Bi:2:033:2 -115 4096 <
efec8ec0 145525835 S Bi:2:033:2 -115 4096 <
e16028c0 145525836 S Bi:2:033:2 -115 4096 <
e169a9c0 145525837 S Bi:2:033:2 -115 4096 <
f54559c0 145525839 S Bi:2:033:2 -115 4096 <
f6c48240 145525840 S Bi:2:033:2 -115 4096 <
efd1f0c0 145525841 S Bi:2:033:2 -115 4096 <
e169ac40 145525842 S Bi:2:033:2 -115 4096 <
e169a7c0 145525843 S Bi:2:033:2 -115 4096 <
efd1f740 145525844 S Bi:2:033:2 -115 4096 <
f57f08c0 145525845 S Bi:2:033:2 -115 4096 <
f573a1c0 145525846 S Bi:2:033:2 -115 4096 <
e169a440 145525847 S Bi:2:033:2 -115 3072 <
f57f0540 145527864 C Bi:2:033:2 0 512 = 00000000 00000000 00000000 00000000 00000000 00000000 00000000 00000000
f22d6c40 145527867 C Bi:2:033:2 0 4096 = 00000000 00000000 00000000 00000000 00000000 00000000 00000000 00000000
f54556c0 145527868 C Bi:2:033:2 0 4096 = 00000000 00000000 00000000 00000000 00000000 00000000 00000000 00000000
f57f0ac0 145527869 C Bi:2:033:2 0 4096 = 00000000 00000000 00000000 00000000 00000000 00000000 00000000 00000000
e16cd9c0 145527870 C Bi:2:033:2 0 4096 = 00000000 00000000 00000000 00000000 00000000 00000000 00000000 00000000
efec8ec0 145527871 C Bi:2:033:2 0 4096 = 00000000 00000000 00000000 00000000 00000000 00000000 00000000 00000000
e16028c0 145527872 C Bi:2:033:2 0 4096 = 00000000 00000000 00000000 00000000 00000000 00000000 00000000 00000000
e169a9c0 145529695 C Bi:2:033:2 0 4096 = 00000000 00000000 00000000 00000000 00000000 00000000 00000000 00000000
f54559c0 145529698 C Bi:2:033:2 0 4096 = 00000000 00000000 00000000 00000000 00000000 00000000 00000000 00000000
f6c48240 145529699 C Bi:2:033:2 0 4096 = 00000000 00000000 00000000 00000000 00000000 00000000 00000000 00000000
efd1f0c0 145529700 C Bi:2:033:2 0 4096 = 00000000 00000000 00000000 00000000 00000000 00000000 00000000 00000000
e169ac40 145529701 C Bi:2:033:2 0 4096 = 00000000 00000000 00000000 00000000 00000000 00000000 00000000 00000000
e169a7c0 145529702 C Bi:2:033:2 0 4096 = 00000000 00000000 00000000 00000000 00000000 00000000 00000000 00000000
efd1f740 145529703 C Bi:2:033:2 0 4096 = 00000000 00000000 00000000 00000000 00000000 00000000 00000000 00000000
f57f08c0 145529704 C Bi:2:033:2 0 4096 = 00000000 00000000 00000000 00000000 00000000 00000000 00000000 00000000
f573a1c0 145529705 C Bi:2:033:2 0 4096 = 00000000 00000000 00000000 00000000 00000000 00000000 00000000 00000000
e169a440 145529706 C Bi:2:033:2 0 3072 = 00000000 00000000 00000000 00000000 00000000 00000000 00000000 00000000
f544bac0 145529713 S Bi:2:033:2 -115 13 <
f544bac0 145529820 C Bi:2:033:2 0 13 = 55534253 4b000000 00000000 00
f544bac0 145530336 S Bo:2:033:1 -115 31 = 55534243 4c000000 00020000 80000a28 00000006 26000001 00000000 000000
f544bac0 145530819 C Bo:2:033:1 0 31 >
f57f0540 145530827 S Bi:2:033:2 -115 512 <
f57f0540 145531819 C Bi:2:033:2 0 512 = 00000000 00000000 00000000 00000000 00000000 00000000 00000000 00000000
f544bac0 145531826 S Bi:2:033:2 -115 13 <
f544bac0 145531946 C Bi:2:033:2 0 13 = 55534253 4c000000 00000000 00
f544bac0 145531969 S Bo:2:033:1 -115 31 = 55534243 4d000000 00000100 80000a28 00000006 27000080 00000000 000000
f544bac0 145532819 C Bo:2:033:1 0 31 >
f57f0540 145532830 S Bi:2:033:2 -115 512 <
f22d6c40 145532831 S Bi:2:033:2 -115 4096 <
f54556c0 145532832 S Bi:2:033:2 -115 4096 <
f57f0ac0 145532833 S Bi:2:033:2 -115 4096 <
e16cd9c0 145532834 S Bi:2:033:2 -115 4096 <
efec8ec0 145532835 S Bi:2:033:2 -115 4096 <
e16028c0 145532836 S Bi:2:033:2 -115 4096 <
e169a9c0 145532837 S Bi:2:033:2 -115 4096 <
f54559c0 145532838 S Bi:2:033:2 -115 4096 <
f6c48240 145532840 S Bi:2:033:2 -115 4096 <
efd1f0c0 145532841 S Bi:2:033:2 -115 4096 <
e169ac40 145532842 S Bi:2:033:2 -115 4096 <
e169a7c0 145532843 S Bi:2:033:2 -115 4096 <
efd1f740 145532844 S Bi:2:033:2 -115 4096 <
f57f08c0 145532845 S Bi:2:033:2 -115 4096 <
f573a1c0 145532846 S Bi:2:033:2 -115 4096 <
e169a440 145532847 S Bi:2:033:2 -115 3584 <
f57f0540 145536694 C Bi:2:033:2 0 512 = 00000000 00000000 00000000 00000000 00000000 00000000 00000000 00000000
f22d6c40 145536696 C Bi:2:033:2 0 4096 = 00000000 00000000 00000000 00000000 00000000 00000000 00000000 00000000
f54556c0 145536698 C Bi:2:033:2 0 4096 = 00000000 00000000 00000000 00000000 00000000 00000000 00000000 00000000
f57f0ac0 145536699 C Bi:2:033:2 0 4096 = 00000000 00000000 00000000 00000000 00000000 00000000 00000000 00000000
e16cd9c0 145536700 C Bi:2:033:2 0 4096 = 00000000 00000000 00000000 00000000 00000000 00000000 00000000 00000000
efec8ec0 145536701 C Bi:2:033:2 0 4096 = 00000000 00000000 00000000 00000000 00000000 00000000 00000000 00000000
e16028c0 145536702 C Bi:2:033:2 0 4096 = 00000000 00000000 00000000 00000000 00000000 00000000 00000000 00000000
e169a9c0 145536703 C Bi:2:033:2 0 4096 = 00000000 00000000 00000000 00000000 00000000 00000000 00000000 00000000
f54559c0 145536704 C Bi:2:033:2 0 4096 = 00000000 00000000 00000000 00000000 00000000 00000000 00000000 00000000
f6c48240 145536705 C Bi:2:033:2 0 4096 = 00000000 00000000 00000000 00000000 00000000 00000000 00000000 00000000
efd1f0c0 145536706 C Bi:2:033:2 0 4096 = 00000000 00000000 00000000 00000000 00000000 00000000 00000000 00000000
e169ac40 145536707 C Bi:2:033:2 0 4096 = 00000000 00000000 00000000 00000000 00000000 00000000 00000000 00000000
e169a7c0 145536708 C Bi:2:033:2 0 4096 = 00000000 00000000 00000000 00000000 00000000 00000000 00000000 00000000
efd1f740 145536709 C Bi:2:033:2 0 4096 = 00000000 00000000 00000000 00000000 00000000 00000000 00000000 00000000
f57f08c0 145536710 C Bi:2:033:2 0 4096 = 00000000 00000000 00000000 00000000 00000000 00000000 00000000 00000000
f573a1c0 145536711 C Bi:2:033:2 0 4096 = 00000000 00000000 00000000 00000000 00000000 00000000 00000000 00000000
e169a440 145536712 C Bi:2:033:2 0 3584 = 00000000 00000000 00000000 00000000 00000000 00000000 00000000 00000000
f544bac0 145536720 S Bi:2:033:2 -115 13 <
f544bac0 145536817 C Bi:2:033:2 0 13 = 55534253 4d000000 00000000 00
f544bac0 145537177 S Bo:2:033:1 -115 31 = 55534243 4e000000 00fe0000 80000a28 00000006 a700007f 00000000 000000
f544bac0 145537820 C Bo:2:033:1 0 31 >
f57f0540 145537830 S Bi:2:033:2 -115 512 <
f22d6c40 145537832 S Bi:2:033:2 -115 4096 <
f54556c0 145537833 S Bi:2:033:2 -115 4096 <
f57f0ac0 145537834 S Bi:2:033:2 -115 4096 <
e16cd9c0 145537835 S Bi:2:033:2 -115 4096 <
efec8ec0 145537836 S Bi:2:033:2 -115 4096 <
e16028c0 145537837 S Bi:2:033:2 -115 4096 <
e169a9c0 145537838 S Bi:2:033:2 -115 4096 <
f54559c0 145537839 S Bi:2:033:2 -115 4096 <
f6c48240 145537840 S Bi:2:033:2 -115 4096 <
efd1f0c0 145537841 S Bi:2:033:2 -115 4096 <
e169ac40 145537842 S Bi:2:033:2 -115 4096 <
e169a7c0 145537843 S Bi:2:033:2 -115 4096 <
efd1f740 145537844 S Bi:2:033:2 -115 4096 <
f57f08c0 145537845 S Bi:2:033:2 -115 4096 <
f573a1c0 145537847 S Bi:2:033:2 -115 4096 <
e169a440 145537848 S Bi:2:033:2 -115 3072 <
f57f0540 145541694 C Bi:2:033:2 0 512 = 00000000 00000000 00000000 00000000 00000000 00000000 00000000 00000000
f22d6c40 145541696 C Bi:2:033:2 0 4096 = 00000000 00000000 00000000 00000000 00000000 00000000 00000000 00000000
f54556c0 145541697 C Bi:2:033:2 0 4096 = 00000000 00000000 00000000 00000000 00000000 00000000 00000000 00000000
f57f0ac0 145541698 C Bi:2:033:2 0 4096 = 00000000 00000000 00000000 00000000 00000000 00000000 00000000 00000000
e16cd9c0 145541699 C Bi:2:033:2 0 4096 = 00000000 00000000 00000000 00000000 00000000 00000000 00000000 00000000
efec8ec0 145541701 C Bi:2:033:2 0 4096 = 00000000 00000000 00000000 00000000 00000000 00000000 00000000 00000000
e16028c0 145541702 C Bi:2:033:2 0 4096 = 00000000 00000000 00000000 00000000 00000000 00000000 00000000 00000000
e169a9c0 145541703 C Bi:2:033:2 0 4096 = 00000000 00000000 00000000 00000000 00000000 00000000 00000000 00000000
f54559c0 145541704 C Bi:2:033:2 0 4096 = 00000000 00000000 00000000 00000000 00000000 00000000 00000000 00000000
f6c48240 145541705 C Bi:2:033:2 0 4096 = 00000000 00000000 00000000 00000000 00000000 00000000 00000000 00000000
efd1f0c0 145541706 C Bi:2:033:2 0 4096 = 00000000 00000000 00000000 00000000 00000000 00000000 00000000 00000000
e169ac40 145541707 C Bi:2:033:2 0 4096 = 00000000 00000000 00000000 00000000 00000000 00000000 00000000 00000000
e169a7c0 145541708 C Bi:2:033:2 0 4096 = 00000000 00000000 00000000 00000000 00000000 00000000 00000000 00000000
efd1f740 145541709 C Bi:2:033:2 0 4096 = 00000000 00000000 00000000 00000000 00000000 00000000 00000000 00000000
f57f08c0 145541710 C Bi:2:033:2 0 4096 = 00000000 00000000 00000000 00000000 00000000 00000000 00000000 00000000
f573a1c0 145541711 C Bi:2:033:2 0 4096 = 00000000 00000000 00000000 00000000 00000000 00000000 00000000 00000000
e169a440 145541712 C Bi:2:033:2 0 3072 = 00000000 00000000 00000000 00000000 00000000 00000000 00000000 00000000
f544bac0 145541719 S Bi:2:033:2 -115 13 <
f544bac0 145541818 C Bi:2:033:2 0 13 = 55534253 4e000000 00000000 00
f544bac0 145542273 S Bo:2:033:1 -115 31 = 55534243 4f000000 00020000 80000a28 00000007 26000001 00000000 000000
f544bac0 145542819 C Bo:2:033:1 0 31 >
f57f0540 145542826 S Bi:2:033:2 -115 512 <
f57f0540 145543694 C Bi:2:033:2 0 512 = 00000000 00000000 00000000 00000000 00000000 00000000 00000000 00000000
f544bac0 145543809 S Bi:2:033:2 -115 13 <
f544bac0 145543943 C Bi:2:033:2 0 13 = 55534253 4f000000 00000000 00
f544bac0 145543967 S Bo:2:033:1 -115 31 = 55534243 50000000 00000100 80000a28 00000007 27000080 00000000 000000
f544bac0 145544819 C Bo:2:033:1 0 31 >
f57f0540 145544830 S Bi:2:033:2 -115 512 <
f22d6c40 145544831 S Bi:2:033:2 -115 4096 <
f54556c0 145544832 S Bi:2:033:2 -115 8192 <
f57f0ac0 145544833 S Bi:2:033:2 -115 4096 <
e16cd9c0 145544834 S Bi:2:033:2 -115 4096 <
efec8ec0 145544835 S Bi:2:033:2 -115 4096 <
e16028c0 145544837 S Bi:2:033:2 -115 4096 <
e169a9c0 145544838 S Bi:2:033:2 -115 4096 <
f54559c0 145544839 S Bi:2:033:2 -115 8192 <
f6c48240 145544840 S Bi:2:033:2 -115 8192 <
efd1f0c0 145544841 S Bi:2:033:2 -115 8192 <
e169ac40 145544842 S Bi:2:033:2 -115 7680 <
f57f0540 145548239 C Bi:2:033:2 0 512 = 00000000 00000000 00000000 00000000 00000000 00000000 00000000 00000000
f22d6c40 145548241 C Bi:2:033:2 0 4096 = 00000000 00000000 00000000 00000000 00000000 00000000 00000000 00000000
f54556c0 145548241 C Bi:2:033:2 0 8192 = 00000000 00000000 00000000 00000000 00000000 00000000 00000000 00000000
f57f0ac0 145548242 C Bi:2:033:2 0 4096 = 00000000 00000000 00000000 00000000 00000000 00000000 00000000 00000000
e16cd9c0 145548243 C Bi:2:033:2 0 4096 = 00000000 00000000 00000000 00000000 00000000 00000000 00000000 00000000
efec8ec0 145548243 C Bi:2:033:2 0 4096 = 00000000 00000000 00000000 00000000 00000000 00000000 00000000 00000000
e16028c0 145548244 C Bi:2:033:2 0 4096 = 00000000 00000000 00000000 00000000 00000000 00000000 00000000 00000000
e169a9c0 145548245 C Bi:2:033:2 0 4096 = 00000000 00000000 00000000 00000000 00000000 00000000 00000000 00000000
f54559c0 145548246 C Bi:2:033:2 0 8192 = 00000000 00000000 00000000 00000000 00000000 00000000 00000000 00000000
f6c48240 145548246 C Bi:2:033:2 0 8192 = 00000000 00000000 00000000 00000000 00000000 00000000 00000000 00000000
efd1f0c0 145548247 C Bi:2:033:2 0 8192 = 00000000 00000000 00000000 00000000 00000000 00000000 00000000 00000000
e169ac40 145548693 C Bi:2:033:2 0 7680 = 00000000 00000000 00000000 00000000 00000000 00000000 00000000 00000000
f544bac0 145548701 S Bi:2:033:2 -115 13 <
f544bac0 145548819 C Bi:2:033:2 0 13 = 55534253 50000000 00000000 00
f544bac0 145548854 S Bo:2:033:1 -115 31 = 55534243 51000000 00fe0000 80000a28 00000007 a700007f 00000000 000000
f544bac0 145549819 C Bo:2:033:1 0 31 >
f57f0540 145549828 S Bi:2:033:2 -115 512 <
f22d6c40 145549830 S Bi:2:033:2 -115 8192 <
f54556c0 145549831 S Bi:2:033:2 -115 8192 <
f57f0ac0 145549832 S Bi:2:033:2 -115 8192 <
e16cd9c0 145549833 S Bi:2:033:2 -115 8192 <
efec8ec0 145549834 S Bi:2:033:2 -115 8192 <
e16028c0 145549835 S Bi:2:033:2 -115 8192 <
e169a9c0 145549836 S Bi:2:033:2 -115 8192 <
f54559c0 145549837 S Bi:2:033:2 -115 7168 <
f57f0540 145551732 C Bi:2:033:2 0 512 = 00000000 00000000 00000000 00000000 00000000 00000000 00000000 00000000
f22d6c40 145551735 C Bi:2:033:2 0 8192 = 00000000 00000000 00000000 00000000 00000000 00000000 00000000 00000000
f54556c0 145551736 C Bi:2:033:2 0 8192 = 00000000 00000000 00000000 00000000 00000000 00000000 00000000 00000000
f57f0ac0 145553694 C Bi:2:033:2 0 8192 = 00000000 00000000 00000000 00000000 00000000 00000000 00000000 00000000
e16cd9c0 145553696 C Bi:2:033:2 0 8192 = 00000000 00000000 00000000 00000000 00000000 00000000 00000000 00000000
efec8ec0 145553697 C Bi:2:033:2 0 8192 = 00000000 00000000 00000000 00000000 00000000 00000000 00000000 00000000
e16028c0 145553698 C Bi:2:033:2 0 8192 = 00000000 00000000 00000000 00000000 00000000 00000000 00000000 00000000
e169a9c0 145553699 C Bi:2:033:2 0 8192 = 00000000 00000000 00000000 00000000 00000000 00000000 00000000 00000000
f54559c0 145553700 C Bi:2:033:2 0 7168 = 00000000 00000000 00000000 00000000 00000000 00000000 00000000 00000000
f544bac0 145553706 S Bi:2:033:2 -115 13 <
f544bac0 145553818 C Bi:2:033:2 0 13 = 55534253 51000000 00000000 00
f544bac0 145554293 S Bo:2:033:1 -115 31 = 55534243 52000000 00020000 80000a28 00000008 26000001 00000000 000000
f544bac0 145554818 C Bo:2:033:1 0 31 >
f57f0540 145554826 S Bi:2:033:2 -115 512 <
f57f0540 145555818 C Bi:2:033:2 0 512 = 00000000 00000000 00000000 00000000 00000000 00000000 00000000 00000000
f544bac0 145555825 S Bi:2:033:2 -115 13 <
f544bac0 145555944 C Bi:2:033:2 0 13 = 55534253 52000000 00000000 00
f544bac0 145556040 S Bo:2:033:1 -115 31 = 55534243 53000000 00000100 80000a28 00000008 27000080 00000000 000000
f544bac0 145556818 C Bo:2:033:1 0 31 >
f57f0540 145556827 S Bi:2:033:2 -115 512 <
f22d6c40 145556828 S Bi:2:033:2 -115 8192 <
f54556c0 145556830 S Bi:2:033:2 -115 8192 <
f57f0ac0 145556831 S Bi:2:033:2 -115 8192 <
e16cd9c0 145556832 S Bi:2:033:2 -115 8192 <
efec8ec0 145556833 S Bi:2:033:2 -115 8192 <
e16028c0 145556834 S Bi:2:033:2 -115 8192 <
e169a9c0 145556835 S Bi:2:033:2 -115 8192 <
f54559c0 145556836 S Bi:2:033:2 -115 7680 <
f57f0540 145560693 C Bi:2:033:2 0 512 = 00000000 00000000 00000000 00000000 00000000 00000000 00000000 00000000
f22d6c40 145560695 C Bi:2:033:2 0 8192 = 00000000 00000000 00000000 00000000 00000000 00000000 00000000 00000000
f54556c0 145560696 C Bi:2:033:2 0 8192 = 00000000 00000000 00000000 00000000 00000000 00000000 00000000 00000000
f57f0ac0 145560697 C Bi:2:033:2 0 8192 = 00000000 00000000 00000000 00000000 00000000 00000000 00000000 00000000
e16cd9c0 145560698 C Bi:2:033:2 0 8192 = 00000000 00000000 00000000 00000000 00000000 00000000 00000000 00000000
efec8ec0 145560699 C Bi:2:033:2 0 8192 = 00000000 00000000 00000000 00000000 00000000 00000000 00000000 00000000
e16028c0 145560700 C Bi:2:033:2 0 8192 = 00000000 00000000 00000000 00000000 00000000 00000000 00000000 00000000
e169a9c0 145560701 C Bi:2:033:2 0 8192 = 00000000 00000000 00000000 00000000 00000000 00000000 00000000 00000000
f54559c0 145560702 C Bi:2:033:2 0 7680 = 00000000 00000000 00000000 00000000 00000000 00000000 00000000 00000000
f544bac0 145560709 S Bi:2:033:2 -115 13 <
f544bac0 145560819 C Bi:2:033:2 0 13 = 55534253 53000000 00000000 00
f544bac0 145560868 S Bo:2:033:1 -115 31 = 55534243 54000000 00fe0000 80000a28 00000008 a700007f 00000000 000000
f544bac0 145561819 C Bo:2:033:1 0 31 >
f57f0540 145561828 S Bi:2:033:2 -115 512 <
f22d6c40 145561829 S Bi:2:033:2 -115 8192 <
f54556c0 145561830 S Bi:2:033:2 -115 8192 <
f57f0ac0 145561831 S Bi:2:033:2 -115 8192 <
e16cd9c0 145561832 S Bi:2:033:2 -115 8192 <
efec8ec0 145561833 S Bi:2:033:2 -115 8192 <
e16028c0 145561834 S Bi:2:033:2 -115 8192 <
e169a9c0 145561835 S Bi:2:033:2 -115 8192 <
f54559c0 145561836 S Bi:2:033:2 -115 7168 <
f57f0540 145563515 C Bi:2:033:2 0 512 = 00000000 00000000 00000000 00000000 00000000 00000000 00000000 00000000
f22d6c40 145563518 C Bi:2:033:2 0 8192 = 00000000 00000000 00000000 00000000 00000000 00000000 00000000 00000000
f54556c0 145563519 C Bi:2:033:2 0 8192 = 00000000 00000000 00000000 00000000 00000000 00000000 00000000 00000000
f57f0ac0 145565693 C Bi:2:033:2 0 8192 = 00000000 00000000 00000000 00000000 00000000 00000000 00000000 00000000
e16cd9c0 145565696 C Bi:2:033:2 0 8192 = 00000000 00000000 00000000 00000000 00000000 00000000 00000000 00000000
efec8ec0 145565697 C Bi:2:033:2 0 8192 = 00000000 00000000 00000000 00000000 00000000 00000000 00000000 00000000
e16028c0 145565698 C Bi:2:033:2 0 8192 = 00000000 00000000 00000000 00000000 00000000 00000000 00000000 00000000
e169a9c0 145565699 C Bi:2:033:2 0 8192 = 00000000 00000000 00000000 00000000 00000000 00000000 00000000 00000000
f54559c0 145565700 C Bi:2:033:2 0 7168 = 00000000 00000000 00000000 00000000 00000000 00000000 00000000 00000000
f544bac0 145565707 S Bi:2:033:2 -115 13 <
f544bac0 145565819 C Bi:2:033:2 0 13 = 55534253 54000000 00000000 00
f544bac0 145566333 S Bo:2:033:1 -115 31 = 55534243 55000000 00000100 80000a28 00000009 26000080 00000000 000000
f544bac0 145566818 C Bo:2:033:1 0 31 >
f57f0540 145566827 S Bi:2:033:2 -115 1024 <
f22d6c40 145566829 S Bi:2:033:2 -115 8192 <
f54556c0 145566830 S Bi:2:033:2 -115 8192 <
f57f0ac0 145566831 S Bi:2:033:2 -115 8192 <
e16cd9c0 145566832 S Bi:2:033:2 -115 8192 <
efec8ec0 145566833 S Bi:2:033:2 -115 8192 <
e16028c0 145566834 S Bi:2:033:2 -115 8192 <
e169a9c0 145566835 S Bi:2:033:2 -115 8192 <
f54559c0 145566836 S Bi:2:033:2 -115 7168 <
f57f0540 145568398 C Bi:2:033:2 0 1024 = 00000000 00000000 00000000 00000000 00000000 00000000 00000000 00000000
f22d6c40 145568401 C Bi:2:033:2 0 8192 = 00000000 00000000 00000000 00000000 00000000 00000000 00000000 00000000
f54556c0 145570693 C Bi:2:033:2 0 8192 = 00000000 00000000 00000000 00000000 00000000 00000000 00000000 00000000
f57f0ac0 145570695 C Bi:2:033:2 0 8192 = 00000000 00000000 00000000 00000000 00000000 00000000 00000000 00000000
e16cd9c0 145570696 C Bi:2:033:2 0 8192 = 00000000 00000000 00000000 00000000 00000000 00000000 00000000 00000000
efec8ec0 145570698 C Bi:2:033:2 0 8192 = 00000000 00000000 00000000 00000000 00000000 00000000 00000000 00000000
e16028c0 145570699 C Bi:2:033:2 0 8192 = 00000000 00000000 00000000 00000000 00000000 00000000 00000000 00000000
e169a9c0 145570700 C Bi:2:033:2 0 8192 = 00000000 00000000 00000000 00000000 00000000 00000000 00000000 00000000
f54559c0 145570701 C Bi:2:033:2 0 7168 = 00000000 00000000 00000000 00000000 00000000 00000000 00000000 00000000
f544bac0 145570708 S Bi:2:033:2 -115 13 <
f544bac0 145570818 C Bi:2:033:2 0 13 = 55534253 55000000 00000000 00
f544bac0 145570868 S Bo:2:033:1 -115 31 = 55534243 56000000 00000100 80000a28 00000009 a6000080 00000000 000000
f544bac0 145571818 C Bo:2:033:1 0 31 >
f57f0540 145571828 S Bi:2:033:2 -115 1024 <
f22d6c40 145571829 S Bi:2:033:2 -115 8192 <
f54556c0 145571831 S Bi:2:033:2 -115 8192 <
f57f0ac0 145571832 S Bi:2:033:2 -115 8192 <
e16cd9c0 145571833 S Bi:2:033:2 -115 8192 <
efec8ec0 145571834 S Bi:2:033:2 -115 8192 <
e16028c0 145571835 S Bi:2:033:2 -115 8192 <
e169a9c0 145571836 S Bi:2:033:2 -115 8192 <
f54559c0 145571837 S Bi:2:033:2 -115 7168 <
f57f0540 145575693 C Bi:2:033:2 0 1024 = 00000000 00000000 00000000 00000000 00000000 00000000 00000000 00000000
f22d6c40 145575695 C Bi:2:033:2 0 8192 = 00000000 00000000 00000000 00000000 00000000 00000000 00000000 00000000
f54556c0 145575696 C Bi:2:033:2 0 8192 = 00000000 00000000 00000000 00000000 00000000 00000000 00000000 00000000
f57f0ac0 145575697 C Bi:2:033:2 0 8192 = 00000000 00000000 00000000 00000000 00000000 00000000 00000000 00000000
e16cd9c0 145575699 C Bi:2:033:2 0 8192 = 00000000 00000000 00000000 00000000 00000000 00000000 00000000 00000000
efec8ec0 145575700 C Bi:2:033:2 0 8192 = 00000000 00000000 00000000 00000000 00000000 00000000 00000000 00000000
e16028c0 145575701 C Bi:2:033:2 0 8192 = 00000000 00000000 00000000 00000000 00000000 00000000 00000000 00000000
e169a9c0 145575702 C Bi:2:033:2 0 8192 = 00000000 00000000 00000000 00000000 00000000 00000000 00000000 00000000
f54559c0 145575703 C Bi:2:033:2 0 7168 = 00000000 00000000 00000000 00000000 00000000 00000000 00000000 00000000
f544bac0 145575710 S Bi:2:033:2 -115 13 <
f544bac0 145575819 C Bi:2:033:2 0 13 = 55534253 56000000 00000000 00
f544bac0 145576330 S Bo:2:033:1 -115 31 = 55534243 57000000 00020000 80000a28 0000000a 26000001 00000000 000000
f544bac0 145576818 C Bo:2:033:1 0 31 >
f57f0540 145576825 S Bi:2:033:2 -115 512 <
f57f0540 145577817 C Bi:2:033:2 0 512 = 00000000 00000000 00000000 00000000 00000000 00000000 00000000 00000000
f544bac0 145577825 S Bi:2:033:2 -115 13 <
f544bac0 145577944 C Bi:2:033:2 0 13 = 55534253 57000000 00000000 00
f544bac0 145577966 S Bo:2:033:1 -115 31 = 55534243 58000000 00000100 80000a28 0000000a 27000080 00000000 000000
f544bac0 145578818 C Bo:2:033:1 0 31 >
f57f0540 145578827 S Bi:2:033:2 -115 512 <
f22d6c40 145578828 S Bi:2:033:2 -115 8192 <
f54556c0 145578829 S Bi:2:033:2 -115 8192 <
f57f0ac0 145578830 S Bi:2:033:2 -115 8192 <
e16cd9c0 145578831 S Bi:2:033:2 -115 8192 <
efec8ec0 145578833 S Bi:2:033:2 -115 8192 <
e16028c0 145578834 S Bi:2:033:2 -115 8192 <
e169a9c0 145578835 S Bi:2:033:2 -115 8192 <
f54559c0 145578836 S Bi:2:033:2 -115 7680 <
f57f0540 145582442 C Bi:2:033:2 0 512 = 00000000 00000000 00000000 00000000 00000000 00000000 00000000 00000000
f22d6c40 145582444 C Bi:2:033:2 0 8192 = 00000000 00000000 00000000 00000000 00000000 00000000 00000000 00000000
f54556c0 145582445 C Bi:2:033:2 0 8192 = 00000000 00000000 00000000 00000000 00000000 00000000 00000000 00000000
f57f0ac0 145582447 C Bi:2:033:2 0 8192 = 00000000 00000000 00000000 00000000 00000000 00000000 00000000 00000000
e16cd9c0 145582448 C Bi:2:033:2 0 8192 = 00000000 00000000 00000000 00000000 00000000 00000000 00000000 00000000
efec8ec0 145582449 C Bi:2:033:2 0 8192 = 00000000 00000000 00000000 00000000 00000000 00000000 00000000 00000000
e16028c0 145582450 C Bi:2:033:2 0 8192 = 00000000 00000000 00000000 00000000 00000000 00000000 00000000 00000000
e169a9c0 145582451 C Bi:2:033:2 0 8192 = 00000000 00000000 00000000 00000000 00000000 00000000 00000000 00000000
f54559c0 145582452 C Bi:2:033:2 0 7680 = 00000000 00000000 00000000 00000000 00000000 00000000 00000000 00000000
f544bac0 145582457 S Bi:2:033:2 -115 13 <
f544bac0 145582568 C Bi:2:033:2 0 13 = 55534253 58000000 00000000 00
f544bac0 145582618 S Bo:2:033:1 -115 31 = 55534243 59000000 00fe0000 80000a28 0000000a a700007f 00000000 000000
f544bac0 145582817 C Bo:2:033:1 0 31 >
f57f0540 145582868 S Bi:2:033:2 -115 512 <
f22d6c40 145582869 S Bi:2:033:2 -115 8192 <
f54556c0 145582869 S Bi:2:033:2 -115 8192 <
f57f0ac0 145582870 S Bi:2:033:2 -115 8192 <
e16cd9c0 145582871 S Bi:2:033:2 -115 8192 <
efec8ec0 145582871 S Bi:2:033:2 -115 8192 <
e16028c0 145582872 S Bi:2:033:2 -115 8192 <
e169a9c0 145582873 S Bi:2:033:2 -115 8192 <
f54559c0 145582873 S Bi:2:033:2 -115 7168 <
f57f0540 145586318 C Bi:2:033:2 0 512 = 00000000 00000000 00000000 00000000 00000000 00000000 00000000 00000000
f22d6c40 145586321 C Bi:2:033:2 0 8192 = 00000000 00000000 00000000 00000000 00000000 00000000 00000000 00000000
f54556c0 145586322 C Bi:2:033:2 0 8192 = 00000000 00000000 00000000 00000000 00000000 00000000 00000000 00000000
f57f0ac0 145586323 C Bi:2:033:2 0 8192 = 00000000 00000000 00000000 00000000 00000000 00000000 00000000 00000000
e16cd9c0 145586324 C Bi:2:033:2 0 8192 = 00000000 00000000 00000000 00000000 00000000 00000000 00000000 00000000
efec8ec0 145586325 C Bi:2:033:2 0 8192 = 00000000 00000000 00000000 00000000 00000000 00000000 00000000 00000000
e16028c0 145586326 C Bi:2:033:2 0 8192 = 00000000 00000000 00000000 00000000 00000000 00000000 00000000 00000000
e169a9c0 145586327 C Bi:2:033:2 0 8192 = 00000000 00000000 00000000 00000000 00000000 00000000 00000000 00000000
f54559c0 145586328 C Bi:2:033:2 0 7168 = 00000000 00000000 00000000 00000000 00000000 00000000 00000000 00000000
f544bac0 145586335 S Bi:2:033:2 -115 13 <
f544bac0 145586443 C Bi:2:033:2 0 13 = 55534253 59000000 00000000 00
f544bac0 145586961 S Bo:2:033:1 -115 31 = 55534243 5a000000 00020000 80000a28 0000000b 26000001 00000000 000000
f544bac0 145587818 C Bo:2:033:1 0 31 >
f57f0540 145587826 S Bi:2:033:2 -115 512 <
f57f0540 145588817 C Bi:2:033:2 0 512 = 00000000 00000000 00000000 00000000 00000000 00000000 00000000 00000000
f544bac0 145588824 S Bi:2:033:2 -115 13 <
f544bac0 145588944 C Bi:2:033:2 0 13 = 55534253 5a000000 00000000 00
f544bac0 145588966 S Bo:2:033:1 -115 31 = 55534243 5b000000 00000100 80000a28 0000000b 27000080 00000000 000000
f544bac0 145589818 C Bo:2:033:1 0 31 >
f57f0540 145589827 S Bi:2:033:2 -115 512 <
f22d6c40 145589829 S Bi:2:033:2 -115 8192 <
f54556c0 145589830 S Bi:2:033:2 -115 8192 <
f57f0ac0 145589831 S Bi:2:033:2 -115 8192 <
e16cd9c0 145589832 S Bi:2:033:2 -115 8192 <
efec8ec0 145589833 S Bi:2:033:2 -115 8192 <
e16028c0 145589834 S Bi:2:033:2 -115 8192 <
e169a9c0 145589835 S Bi:2:033:2 -115 8192 <
f54559c0 145589836 S Bi:2:033:2 -115 7680 <
f57f0540 145593343 C Bi:2:033:2 0 512 = 00000000 00000000 00000000 00000000 00000000 00000000 00000000 00000000
f22d6c40 145593345 C Bi:2:033:2 0 8192 = 00000000 00000000 00000000 00000000 00000000 00000000 00000000 00000000
f54556c0 145593346 C Bi:2:033:2 0 8192 = 00000000 00000000 00000000 00000000 00000000 00000000 00000000 00000000
f57f0ac0 145593347 C Bi:2:033:2 0 8192 = 00000000 00000000 00000000 00000000 00000000 00000000 00000000 00000000
e16cd9c0 145593348 C Bi:2:033:2 0 8192 = 00000000 00000000 00000000 00000000 00000000 00000000 00000000 00000000
efec8ec0 145593349 C Bi:2:033:2 0 8192 = 00000000 00000000 00000000 00000000 00000000 00000000 00000000 00000000
e16028c0 145593350 C Bi:2:033:2 0 8192 = 00000000 00000000 00000000 00000000 00000000 00000000 00000000 00000000
e169a9c0 145593351 C Bi:2:033:2 0 8192 = 00000000 00000000 00000000 00000000 00000000 00000000 00000000 00000000
f54559c0 145593692 C Bi:2:033:2 0 7680 = 00000000 00000000 00000000 00000000 00000000 00000000 00000000 00000000
f544bac0 145593699 S Bi:2:033:2 -115 13 <
f544bac0 145593818 C Bi:2:033:2 0 13 = 55534253 5b000000 00000000 00
f544bac0 145593867 S Bo:2:033:1 -115 31 = 55534243 5c000000 00fe0000 80000a28 0000000b a700007f 00000000 000000
f544bac0 145594817 C Bo:2:033:1 0 31 >
f57f0540 145594827 S Bi:2:033:2 -115 512 <
f22d6c40 145594828 S Bi:2:033:2 -115 8192 <
f54556c0 145594829 S Bi:2:033:2 -115 8192 <
f57f0ac0 145594830 S Bi:2:033:2 -115 8192 <
e16cd9c0 145594831 S Bi:2:033:2 -115 8192 <
efec8ec0 145594833 S Bi:2:033:2 -115 8192 <
e16028c0 145594834 S Bi:2:033:2 -115 8192 <
e169a9c0 145594835 S Bi:2:033:2 -115 8192 <
f54559c0 145594836 S Bi:2:033:2 -115 7168 <
f57f0540 145595818 C Bi:2:033:2 0 512 = 00000000 00000000 00000000 00000000 00000000 00000000 00000000 00000000
f22d6c40 145598693 C Bi:2:033:2 0 8192 = 00000000 00000000 00000000 00000000 00000000 00000000 00000000 00000000
f54556c0 145598695 C Bi:2:033:2 0 8192 = 00000000 00000000 00000000 00000000 00000000 00000000 00000000 00000000
f57f0ac0 145598697 C Bi:2:033:2 0 8192 = 00000000 00000000 00000000 00000000 00000000 00000000 00000000 00000000
e16cd9c0 145598698 C Bi:2:033:2 0 8192 = 00000000 00000000 00000000 00000000 00000000 00000000 00000000 00000000
efec8ec0 145598699 C Bi:2:033:2 0 8192 = 00000000 00000000 00000000 00000000 00000000 00000000 00000000 00000000
e16028c0 145598700 C Bi:2:033:2 0 8192 = 00000000 00000000 00000000 00000000 00000000 00000000 00000000 00000000
e169a9c0 145598701 C Bi:2:033:2 0 8192 = 00000000 00000000 00000000 00000000 00000000 00000000 00000000 00000000
f54559c0 145598702 C Bi:2:033:2 0 7168 = 00000000 00000000 00000000 00000000 00000000 00000000 00000000 00000000
f544bac0 145598709 S Bi:2:033:2 -115 13 <
f544bac0 145598818 C Bi:2:033:2 0 13 = 55534253 5c000000 00000000 00
f544bac0 145599350 S Bo:2:033:1 -115 31 = 55534243 5d000000 00020000 80000a28 0000000c 26000001 00000000 000000
f544bac0 145599817 C Bo:2:033:1 0 31 >
f57f0540 145599825 S Bi:2:033:2 -115 512 <
f57f0540 145600815 C Bi:2:033:2 0 512 = 00000000 00000000 00000000 00000000 00000000 00000000 00000000 00000000
f544bac0 145601147 S Bi:2:033:2 -115 13 <
f544bac0 145601192 C Bi:2:033:2 0 13 = 55534253 5d000000 00000000 00
f544bac0 145601214 S Bo:2:033:1 -115 31 = 55534243 5e000000 00000100 80000a28 0000000c 27000080 00000000 000000
f544bac0 145601817 C Bo:2:033:1 0 31 >
f57f0540 145601826 S Bi:2:033:2 -115 512 <
f22d6c40 145601828 S Bi:2:033:2 -115 8192 <
f54556c0 145601829 S Bi:2:033:2 -115 8192 <
f57f0ac0 145601830 S Bi:2:033:2 -115 8192 <
e16cd9c0 145601831 S Bi:2:033:2 -115 8192 <
efec8ec0 145601832 S Bi:2:033:2 -115 8192 <
e16028c0 145601833 S Bi:2:033:2 -115 8192 <
e169a9c0 145601834 S Bi:2:033:2 -115 8192 <
f54559c0 145601835 S Bi:2:033:2 -115 7680 <
f57f0540 145604260 C Bi:2:033:2 0 512 = 00000000 00000000 00000000 00000000 00000000 00000000 00000000 00000000
f22d6c40 145604263 C Bi:2:033:2 0 8192 = 00000000 00000000 00000000 00000000 00000000 00000000 00000000 00000000
f54556c0 145604264 C Bi:2:033:2 0 8192 = 00000000 00000000 00000000 00000000 00000000 00000000 00000000 00000000
f57f0ac0 145604265 C Bi:2:033:2 0 8192 = 00000000 00000000 00000000 00000000 00000000 00000000 00000000 00000000
e16cd9c0 145604266 C Bi:2:033:2 0 8192 = 00000000 00000000 00000000 00000000 00000000 00000000 00000000 00000000
efec8ec0 145605692 C Bi:2:033:2 0 8192 = 00000000 00000000 00000000 00000000 00000000 00000000 00000000 00000000
e16028c0 145605694 C Bi:2:033:2 0 8192 = 00000000 00000000 00000000 00000000 00000000 00000000 00000000 00000000
e169a9c0 145605695 C Bi:2:033:2 0 8192 = 00000000 00000000 00000000 00000000 00000000 00000000 00000000 00000000
f54559c0 145605696 C Bi:2:033:2 0 7680 = 00000000 00000000 00000000 00000000 00000000 00000000 00000000 00000000
f544bac0 145605702 S Bi:2:033:2 -115 13 <
f544bac0 145605817 C Bi:2:033:2 0 13 = 55534253 5e000000 00000000 00
f544bac0 145605867 S Bo:2:033:1 -115 31 = 55534243 5f000000 00fe0000 80000a28 0000000c a700007f 00000000 000000
f544bac0 145606816 C Bo:2:033:1 0 31 >
f57f0540 145606825 S Bi:2:033:2 -115 512 <
f22d6c40 145606827 S Bi:2:033:2 -115 8192 <
f54556c0 145606828 S Bi:2:033:2 -115 8192 <
f57f0ac0 145606829 S Bi:2:033:2 -115 8192 <
e16cd9c0 145606830 S Bi:2:033:2 -115 8192 <
efec8ec0 145606831 S Bi:2:033:2 -115 8192 <
e16028c0 145606832 S Bi:2:033:2 -115 8192 <
e169a9c0 145606833 S Bi:2:033:2 -115 8192 <
f54559c0 145606834 S Bi:2:033:2 -115 7168 <
f57f0540 145608262 C Bi:2:033:2 0 512 = 00000000 00000000 00000000 00000000 00000000 00000000 00000000 00000000
f22d6c40 145608265 C Bi:2:033:2 0 8192 = 00000000 00000000 00000000 00000000 00000000 00000000 00000000 00000000
f54556c0 145610691 C Bi:2:033:2 0 8192 = 00000000 00000000 00000000 00000000 00000000 00000000 00000000 00000000
f57f0ac0 145610693 C Bi:2:033:2 0 8192 = 00000000 00000000 00000000 00000000 00000000 00000000 00000000 00000000
e16cd9c0 145610694 C Bi:2:033:2 0 8192 = 00000000 00000000 00000000 00000000 00000000 00000000 00000000 00000000
efec8ec0 145610695 C Bi:2:033:2 0 8192 = 00000000 00000000 00000000 00000000 00000000 00000000 00000000 00000000
e16028c0 145610696 C Bi:2:033:2 0 8192 = 00000000 00000000 00000000 00000000 00000000 00000000 00000000 00000000
e169a9c0 145610697 C Bi:2:033:2 0 8192 = 00000000 00000000 00000000 00000000 00000000 00000000 00000000 00000000
f54559c0 145610698 C Bi:2:033:2 0 7168 = 00000000 00000000 00000000 00000000 00000000 00000000 00000000 00000000
f544bac0 145610704 S Bi:2:033:2 -115 13 <
f544bac0 145610816 C Bi:2:033:2 0 13 = 55534253 5f000000 00000000 00
f544bac0 145611282 S Bo:2:033:1 -115 31 = 55534243 60000000 00020000 80000a28 0000000d 26000001 00000000 000000
f544bac0 145611817 C Bo:2:033:1 0 31 >
f57f0540 145611825 S Bi:2:033:2 -115 512 <
f57f0540 145612816 C Bi:2:033:2 0 512 = 00000000 00000000 00000000 00000000 00000000 00000000 00000000 00000000
f544bac0 145612823 S Bi:2:033:2 -115 13 <
f544bac0 145612943 C Bi:2:033:2 0 13 = 55534253 60000000 00000000 00
f544bac0 145612965 S Bo:2:033:1 -115 31 = 55534243 61000000 00000100 80000a28 0000000d 27000080 00000000 000000
f544bac0 145613816 C Bo:2:033:1 0 31 >
f57f0540 145613825 S Bi:2:033:2 -115 512 <
f22d6c40 145613827 S Bi:2:033:2 -115 8192 <
f54556c0 145613828 S Bi:2:033:2 -115 8192 <
f57f0ac0 145613829 S Bi:2:033:2 -115 8192 <
e16cd9c0 145613830 S Bi:2:033:2 -115 8192 <
efec8ec0 145613831 S Bi:2:033:2 -115 8192 <
e16028c0 145613832 S Bi:2:033:2 -115 8192 <
e169a9c0 145613833 S Bi:2:033:2 -115 8192 <
f54559c0 145613834 S Bi:2:033:2 -115 7680 <
f57f0540 145616266 C Bi:2:033:2 0 512 = 00000000 00000000 00000000 00000000 00000000 00000000 00000000 00000000
f22d6c40 145616268 C Bi:2:033:2 0 8192 = 00000000 00000000 00000000 00000000 00000000 00000000 00000000 00000000
f54556c0 145616270 C Bi:2:033:2 0 8192 = 00000000 00000000 00000000 00000000 00000000 00000000 00000000 00000000
f57f0ac0 145616271 C Bi:2:033:2 0 8192 = 00000000 00000000 00000000 00000000 00000000 00000000 00000000 00000000
e16cd9c0 145616272 C Bi:2:033:2 0 8192 = 00000000 00000000 00000000 00000000 00000000 00000000 00000000 00000000
efec8ec0 145617691 C Bi:2:033:2 0 8192 = 00000000 00000000 00000000 00000000 00000000 00000000 00000000 00000000
e16028c0 145617693 C Bi:2:033:2 0 8192 = 00000000 00000000 00000000 00000000 00000000 00000000 00000000 00000000
e169a9c0 145617694 C Bi:2:033:2 0 8192 = 00000000 00000000 00000000 00000000 00000000 00000000 00000000 00000000
f54559c0 145617695 C Bi:2:033:2 0 7680 = 00000000 00000000 00000000 00000000 00000000 00000000 00000000 00000000
f544bac0 145617701 S Bi:2:033:2 -115 13 <
f544bac0 145617817 C Bi:2:033:2 0 13 = 55534253 61000000 00000000 00
f544bac0 145617867 S Bo:2:033:1 -115 31 = 55534243 62000000 00fe0000 80000a28 0000000d a700007f 00000000 000000
f544bac0 145618817 C Bo:2:033:1 0 31 >
f57f0540 145618826 S Bi:2:033:2 -115 512 <
f22d6c40 145618828 S Bi:2:033:2 -115 8192 <
f54556c0 145618829 S Bi:2:033:2 -115 8192 <
f57f0ac0 145618830 S Bi:2:033:2 -115 8192 <
e16cd9c0 145618831 S Bi:2:033:2 -115 8192 <
efec8ec0 145618832 S Bi:2:033:2 -115 8192 <
e16028c0 145618833 S Bi:2:033:2 -115 8192 <
e169a9c0 145618834 S Bi:2:033:2 -115 8192 <
f54559c0 145618835 S Bi:2:033:2 -115 7168 <
f57f0540 145620258 C Bi:2:033:2 0 512 = 00000000 00000000 00000000 00000000 00000000 00000000 00000000 00000000
f22d6c40 145620260 C Bi:2:033:2 0 8192 = 00000000 00000000 00000000 00000000 00000000 00000000 00000000 00000000
f54556c0 145622691 C Bi:2:033:2 0 8192 = 00000000 00000000 00000000 00000000 00000000 00000000 00000000 00000000
f57f0ac0 145622693 C Bi:2:033:2 0 8192 = 00000000 00000000 00000000 00000000 00000000 00000000 00000000 00000000
e16cd9c0 145622694 C Bi:2:033:2 0 8192 = 00000000 00000000 00000000 00000000 00000000 00000000 00000000 00000000
efec8ec0 145622695 C Bi:2:033:2 0 8192 = 00000000 00000000 00000000 00000000 00000000 00000000 00000000 00000000
e16028c0 145622697 C Bi:2:033:2 0 8192 = 00000000 00000000 00000000 00000000 00000000 00000000 00000000 00000000
e169a9c0 145622698 C Bi:2:033:2 0 8192 = 00000000 00000000 00000000 00000000 00000000 00000000 00000000 00000000
f54559c0 145622699 C Bi:2:033:2 0 7168 = 00000000 00000000 00000000 00000000 00000000 00000000 00000000 00000000
f544bac0 145622704 S Bi:2:033:2 -115 13 <
f544bac0 145622816 C Bi:2:033:2 0 13 = 55534253 62000000 00000000 00
f544bac0 145623323 S Bo:2:033:1 -115 31 = 55534243 63000000 00020000 80000a28 0000000e 26000001 00000000 000000
f544bac0 145623816 C Bo:2:033:1 0 31 >
f57f0540 145623824 S Bi:2:033:2 -115 512 <
f57f0540 145624816 C Bi:2:033:2 0 512 = 00000000 00000000 00000000 00000000 00000000 00000000 00000000 00000000
f544bac0 145624824 S Bi:2:033:2 -115 13 <
f544bac0 145624942 C Bi:2:033:2 0 13 = 55534253 63000000 00000000 00
f544bac0 145624965 S Bo:2:033:1 -115 31 = 55534243 64000000 00000100 80000a28 0000000e 27000080 00000000 000000
f544bac0 145625816 C Bo:2:033:1 0 31 >
f57f0540 145625825 S Bi:2:033:2 -115 512 <
f22d6c40 145625827 S Bi:2:033:2 -115 8192 <
f54556c0 145625828 S Bi:2:033:2 -115 8192 <
f57f0ac0 145625829 S Bi:2:033:2 -115 8192 <
e16cd9c0 145625830 S Bi:2:033:2 -115 8192 <
efec8ec0 145625831 S Bi:2:033:2 -115 8192 <
e16028c0 145625832 S Bi:2:033:2 -115 8192 <
e169a9c0 145625833 S Bi:2:033:2 -115 8192 <
f54559c0 145625834 S Bi:2:033:2 -115 7680 <
f57f0540 145627434 C Bi:2:033:2 0 512 = 00000000 00000000 00000000 00000000 00000000 00000000 00000000 00000000
f22d6c40 145627437 C Bi:2:033:2 0 8192 = 00000000 00000000 00000000 00000000 00000000 00000000 00000000 00000000
f54556c0 145627438 C Bi:2:033:2 0 8192 = 00000000 00000000 00000000 00000000 00000000 00000000 00000000 00000000
f57f0ac0 145629691 C Bi:2:033:2 0 8192 = 00000000 00000000 00000000 00000000 00000000 00000000 00000000 00000000
e16cd9c0 145629693 C Bi:2:033:2 0 8192 = 00000000 00000000 00000000 00000000 00000000 00000000 00000000 00000000
efec8ec0 145629694 C Bi:2:033:2 0 8192 = 00000000 00000000 00000000 00000000 00000000 00000000 00000000 00000000
e16028c0 145629695 C Bi:2:033:2 0 8192 = 00000000 00000000 00000000 00000000 00000000 00000000 00000000 00000000
e169a9c0 145629696 C Bi:2:033:2 0 8192 = 00000000 00000000 00000000 00000000 00000000 00000000 00000000 00000000
f54559c0 145629697 C Bi:2:033:2 0 7680 = 00000000 00000000 00000000 00000000 00000000 00000000 00000000 00000000
f544bac0 145629703 S Bi:2:033:2 -115 13 <
f544bac0 145629817 C Bi:2:033:2 0 13 = 55534253 64000000 00000000 00
f544bac0 145629866 S Bo:2:033:1 -115 31 = 55534243 65000000 00fe0000 80000a28 0000000e a700007f 00000000 000000
f544bac0 145630816 C Bo:2:033:1 0 31 >
f57f0540 145630825 S Bi:2:033:2 -115 512 <
f22d6c40 145630827 S Bi:2:033:2 -115 8192 <
f54556c0 145630828 S Bi:2:033:2 -115 8192 <
f57f0ac0 145630829 S Bi:2:033:2 -115 8192 <
e16cd9c0 145630830 S Bi:2:033:2 -115 8192 <
efec8ec0 145630831 S Bi:2:033:2 -115 8192 <
e16028c0 145630832 S Bi:2:033:2 -115 16384 <
e169a9c0 145630833 S Bi:2:033:2 -115 7168 <
f57f0540 145633112 C Bi:2:033:2 0 512 = 00000000 00000000 00000000 00000000 00000000 00000000 00000000 00000000
f22d6c40 145633115 C Bi:2:033:2 0 8192 = 00000000 00000000 00000000 00000000 00000000 00000000 00000000 00000000
f54556c0 145633116 C Bi:2:033:2 0 8192 = 00000000 00000000 00000000 00000000 00000000 00000000 00000000 00000000
f57f0ac0 145633117 C Bi:2:033:2 0 8192 = 00000000 00000000 00000000 00000000 00000000 00000000 00000000 00000000
e16cd9c0 145634691 C Bi:2:033:2 0 8192 = 00000000 00000000 00000000 00000000 00000000 00000000 00000000 00000000
efec8ec0 145634693 C Bi:2:033:2 0 8192 = 00000000 00000000 00000000 00000000 00000000 00000000 00000000 00000000
e16028c0 145634694 C Bi:2:033:2 0 16384 = 00000000 00000000 00000000 00000000 00000000 00000000 00000000 00000000
e169a9c0 145634695 C Bi:2:033:2 0 7168 = 00000000 00000000 00000000 00000000 00000000 00000000 00000000 00000000
f544bac0 145634700 S Bi:2:033:2 -115 13 <
f544bac0 145634817 C Bi:2:033:2 0 13 = 55534253 65000000 00000000 00
f544bac0 145635165 S Bo:2:033:1 -115 31 = 55534243 66000000 00020000 80000a28 0000000f 26000001 00000000 000000
f544bac0 145635816 C Bo:2:033:1 0 31 >
f57f0540 145635824 S Bi:2:033:2 -115 512 <
f57f0540 145636817 C Bi:2:033:2 0 512 = 00000000 00000000 00000000 00000000 00000000 00000000 00000000 00000000
f544bac0 145636826 S Bi:2:033:2 -115 13 <
f544bac0 145636942 C Bi:2:033:2 0 13 = 55534253 66000000 00000000 00
f544bac0 145636962 S Bo:2:033:1 -115 31 = 55534243 67000000 00100000 80000a28 0000000f 27000008 00000000 000000
f544bac0 145637816 C Bo:2:033:1 0 31 >
f57f0540 145637823 S Bi:2:033:2 -115 4096 <
f57f0540 145638940 C Bi:2:033:2 0 4096 = 00000000 00000000 00000000 00000000 00000000 00000000 00000000 00000000
f544bac0 145638947 S Bi:2:033:2 -115 13 <
f544bac0 145639066 C Bi:2:033:2 0 13 = 55534253 67000000 00000000 00
f544bac0 148099331 S Bo:2:033:1 -115 31 = 55534243 68000000 00000000 00000600 00000000 00000000 00000000 000000
f544bac0 148099368 C Bo:2:033:1 0 31 >
f544bac0 148099375 S Bi:2:033:2 -115 13 <
f544bac0 148099737 C Bi:2:033:2 0 13 = 55534253 68000000 00000000 00
f544bac0 148101247 S Bo:2:033:1 -115 31 = 55534243 69000000 00000000 00000600 00000000 00000000 00000000 000000
f544bac0 148101738 C Bo:2:033:1 0 31 >
f544bac0 148101765 S Bi:2:033:2 -115 13 <
f544bac0 148102737 C Bi:2:033:2 0 13 = 55534253 69000000 00000000 00
f544bac0 148102834 S Bo:2:033:1 -115 31 = 55534243 6a000000 00020000 80000a28 00000000 02000001 00000000 000000
f544bac0 148102988 C Bo:2:033:1 0 31 >
f22d6c40 148102996 S Bi:2:033:2 -115 512 <
f22d6c40 148103738 C Bi:2:033:2 0 512 = 00000000 00000000 00000000 00000000 00000000 00000000 00000000 00000000
f544bac0 148103747 S Bi:2:033:2 -115 13 <
f544bac0 148103862 C Bi:2:033:2 0 13 = 55534253 6a000000 00000000 00
f544bac0 148103884 S Bo:2:033:1 -115 31 = 55534243 6b000000 000a0000 80000a28 00000000 03000005 00000000 000000
f544bac0 148104737 C Bo:2:033:1 0 31 >
f22d6c40 148104745 S Bi:2:033:2 -115 2560 <
f22d6c40 148105737 C Bi:2:033:2 0 2560 = 00000000 00000000 00000000 00000000 00000000 00000000 00000000 00000000
f544bac0 148105744 S Bi:2:033:2 -115 13 <
f544bac0 148105900 C Bi:2:033:2 0 13 = 55534253 6b000000 00000000 00
f544bac0 148105959 S Bo:2:033:1 -115 31 = 55534243 6c000000 00020000 80000a28 00003c3f 80000001 00000000 000000
f544bac0 148106737 C Bo:2:033:1 0 31 >
f22d6c40 148106744 S Bi:2:033:2 -115 512 <
f22d6c40 148106987 C Bi:2:033:2 0 512 = 44495022 0d0a0909 20202020 7d0d0a09 0920207d 0d0a0909 2020426c 6f636b43
f544bac0 148106994 S Bi:2:033:2 -115 13 <
f544bac0 148107113 C Bi:2:033:2 0 13 = 55534253 6c000000 00000000 00
f544bac0 148107130 S Bo:2:033:1 -115 31 = 55534243 6d000000 000e0000 80000a28 00003c3f 81000007 00000000 000000
f544bac0 148107737 C Bo:2:033:1 0 31 >
f22d6c40 148107744 S Bi:2:033:2 -115 3584 <
f22d6c40 148108737 C Bi:2:033:2 0 3584 = 20202052 54575374 6f726167 65436c61 73730920 20202022 4175746f 220d0a09
f544bac0 148108744 S Bi:2:033:2 -115 13 <
f544bac0 148108864 C Bi:2:033:2 0 13 = 55534253 6d000000 00000000 00
f544bac0 148108901 S Bo:2:033:1 -115 31 = 55534243 6e000000 00020000 80000a28 00003c3f f0000001 00000000 000000
f544bac0 148109737 C Bo:2:033:1 0 31 >
f22d6c40 148109744 S Bi:2:033:2 -115 512 <
f22d6c40 148110737 C Bi:2:033:2 0 512 = 20202020 320d0a20 20202073 7349644e 756d6265 72090920 20202033 0d0a2020
f544bac0 148110744 S Bi:2:033:2 -115 13 <
f544bac0 148110863 C Bi:2:033:2 0 13 = 55534253 6e000000 00000000 00
f544bac0 148110880 S Bo:2:033:1 -115 31 = 55534243 6f000000 000e0000 80000a28 00003c3f f1000007 00000000 000000
f544bac0 148110987 C Bo:2:033:1 0 31 >
f22d6c40 148110994 S Bi:2:033:2 -115 3584 <
f22d6c40 148111737 C Bi:2:033:2 0 3584 = 35203334 2e353735 5d0d0a20 20202073 75627669 65776572 09092020 2020320d
f544bac0 148111744 S Bi:2:033:2 -115 13 <
f544bac0 148111863 C Bi:2:033:2 0 13 = 55534253 6f000000 00000000 00
f544bac0 148111904 S Bo:2:033:1 -115 31 = 55534243 70000000 00020000 80000a28 00000000 08000001 00000000 000000
f544bac0 148112737 C Bo:2:033:1 0 31 >
f22d6c40 148112744 S Bi:2:033:2 -115 512 <
f22d6c40 148113737 C Bi:2:033:2 0 512 = 00000000 00000000 00000000 00000000 00000000 00000000 00000000 00000000
f544bac0 148113744 S Bi:2:033:2 -115 13 <
f544bac0 148113862 C Bi:2:033:2 0 13 = 55534253 70000000 00000000 00
f544bac0 148113879 S Bo:2:033:1 -115 31 = 55534243 71000000 002e0000 80000a28 00000000 09000017 00000000 000000
f544bac0 148114737 C Bo:2:033:1 0 31 >
f22d6c40 148114745 S Bi:2:033:2 -115 3584 <
f54556c0 148114747 S Bi:2:033:2 -115 4096 <
f57f0ac0 148114748 S Bi:2:033:2 -115 4096 <
f22d6c40 148115362 C Bi:2:033:2 0 3584 = 00000000 00000000 00000000 00000000 00000000 00000000 00000000 00000000
f54556c0 148115364 C Bi:2:033:2 0 4096 = 00000000 00000000 00000000 00000000 00000000 00000000 00000000 00000000
f57f0ac0 148115365 C Bi:2:033:2 0 4096 = 00000000 00000000 00000000 00000000 00000000 00000000 00000000 00000000
f544bac0 148115370 S Bi:2:033:2 -115 13 <
f544bac0 148115488 C Bi:2:033:2 0 13 = 55534253 71000000 00000000 00
f544bac0 148115528 S Bo:2:033:1 -115 31 = 55534243 72000000 00020000 80000a28 00003c3f f8000001 00000000 000000
f544bac0 148115737 C Bo:2:033:1 0 31 >
f22d6c40 148115744 S Bi:2:033:2 -115 512 <
f22d6c40 148116737 C Bi:2:033:2 0 512 = 09202020 205b3130 20302031 355d0d0a 20202020 73636f70 65090920 20202049
f544bac0 148116745 S Bi:2:033:2 -115 13 <
f544bac0 148116862 C Bi:2:033:2 0 13 = 55534253 72000000 00000000 00
f544bac0 148116880 S Bo:2:033:1 -115 31 = 55534243 73000000 000c0000 80000a28 00003c3f f9000006 00000000 000000
f544bac0 148117737 C Bo:2:033:1 0 31 >
f22d6c40 148117745 S Bi:2:033:2 -115 3072 <
f22d6c40 148118737 C Bi:2:033:2 0 3072 = 465f444f 55424c45 5f545950 450d0a09 6275734f 626a6563 74090922 41726d4c
f544bac0 148118744 S Bi:2:033:2 -115 13 <
f544bac0 148118863 C Bi:2:033:2 0 13 = 55534253 73000000 00000000 00
f544bac0 148118889 S Bo:2:033:1 -115 31 = 55534243 74000000 00020000 80000a28 00003c3f ff000001 00000000 000000
f544bac0 148119737 C Bo:2:033:1 0 31 >
f22d6c40 148119744 S Bi:2:033:2 -115 512 <
f22d6c40 148120737 C Bi:2:033:2 0 512 = 644c696e 6b436f6e 74726f6c 2e546875 6d624d43 50203d20 6a6f696e 743b5c6e
f544bac0 148120744 S Bi:2:033:2 -115 13 <
f544bac0 148120863 C Bi:2:033:2 0 13 = 55534253 74000000 00000000 00
f544bac0 148120913 S Bo:2:033:1 -115 31 = 55534243 75000000 00020000 80000a28 00003c3f c0000001 00000000 000000
f544bac0 148121737 C Bo:2:033:1 0 31 >
f22d6c40 148121744 S Bi:2:033:2 -115 512 <
f22d6c40 148122737 C Bi:2:033:2 0 512 = 6765436c 61737309 20202020 22417574 6f220d0a 09202020 20446174 614c6f67
f544bac0 148122745 S Bi:2:033:2 -115 13 <
f544bac0 148122862 C Bi:2:033:2 0 13 = 55534253 75000000 00000000 00
f544bac0 148122880 S Bo:2:033:1 -115 31 = 55534243 76000000 000e0000 80000a28 00003c3f c1000007 00000000 000000
f544bac0 148122987 C Bo:2:033:1 0 31 >
f22d6c40 148122993 S Bi:2:033:2 -115 3584 <
f22d6c40 148123736 C Bi:2:033:2 0 3584 = 09202050 6f727420 7b0d0a09 20202020 506f7274 4e756d62 65720909 20202020
f544bac0 148123744 S Bi:2:033:2 -115 13 <
f544bac0 148123862 C Bi:2:033:2 0 13 = 55534253 76000000 00000000 00
f544bac0 148123896 S Bo:2:033:1 -115 31 = 55534243 77000000 00020000 80000a28 00003c3f 00000001 00000000 000000
f544bac0 148124736 C Bo:2:033:1 0 31 >
f22d6c40 148124743 S Bi:2:033:2 -115 512 <
f22d6c40 148125736 C Bi:2:033:2 0 512 = 2020204c 6162656c 73090920 2020205b 302c2030 5d0d0a09 09202020 20537263
f544bac0 148125743 S Bi:2:033:2 -115 13 <
f544bac0 148125863 C Bi:2:033:2 0 13 = 55534253 77000000 00000000 00
f544bac0 148125879 S Bo:2:033:1 -115 31 = 55534243 78000000 000e0000 80000a28 00003c3f 01000007 00000000 000000
f544bac0 148126737 C Bo:2:033:1 0 31 >
f22d6c40 148126743 S Bi:2:033:2 -115 3584 <
f22d6c40 148126987 C Bi:2:033:2 0 3584 = 74506f72 74090920 20202031 0d0a0909 20202020 7d0d0a09 09202020 204c696e
f544bac0 148126993 S Bi:2:033:2 -115 13 <
f544bac0 148127113 C Bi:2:033:2 0 13 = 55534253 78000000 00000000 00
f544bac0 148127151 S Bo:2:033:1 -115 31 = 55534243 79000000 00020000 80000a28 00003c3e 70000001 00000000 000000
f544bac0 148127737 C Bo:2:033:1 0 31 >
f22d6c40 148127744 S Bi:2:033:2 -115 512 <
f22d6c40 148128736 C Bi:2:033:2 0 512 = 20204461 74614c6f 6767696e 674e616d 654d6f64 65092020 20202253 69676e61
f544bac0 148128743 S Bi:2:033:2 -115 13 <
f544bac0 148128862 C Bi:2:033:2 0 13 = 55534253 79000000 00000000 00
f544bac0 148128879 S Bo:2:033:1 -115 31 = 55534243 7a000000 000e0000 80000a28 00003c3e 71000007 00000000 000000
f544bac0 148129736 C Bo:2:033:1 0 31 >
f22d6c40 148129743 S Bi:2:033:2 -115 3584 <
f22d6c40 148130736 C Bi:2:033:2 0 3584 = 7d0d0a09 09202020 20426c6f 636b207b 0d0a0909 20202020 426c6f63 6b547970
f544bac0 148130743 S Bi:2:033:2 -115 13 <
f544bac0 148130862 C Bi:2:033:2 0 13 = 55534253 7a000000 00000000 00
f544bac0 148130930 S Bo:2:033:1 -115 31 = 55534243 7b000000 00020000 80000a28 00000000 20000001 00000000 000000
f544bac0 148131737 C Bo:2:033:1 0 31 >
f22d6c40 148131745 S Bi:2:033:2 -115 512 <
f22d6c40 148132736 C Bi:2:033:2 0 512 = 00000000 00000000 00000000 00000000 00000000 00000000 00000000 00000000
f544bac0 148132744 S Bi:2:033:2 -115 13 <
f544bac0 148132863 C Bi:2:033:2 0 13 = 55534253 7b000000 00000000 00
f544bac0 148132881 S Bo:2:033:1 -115 31 = 55534243 7c000000 000a0000 80000a28 00000000 21000005 00000000 000000
f544bac0 148133736 C Bo:2:033:1 0 31 >
f22d6c40 148134076 S Bi:2:033:2 -115 2560 <
f22d6c40 148134736 C Bi:2:033:2 0 2560 = 00000000 00000000 00000000 00000000 00000000 00000000 00000000 00000000
f544bac0 148134744 S Bi:2:033:2 -115 13 <
f544bac0 148134862 C Bi:2:033:2 0 13 = 55534253 7c000000 00000000 00
f544bac0 149231239 S Bo:2:033:1 -115 31 = 55534243 7d000000 00100000 80000a28 0000041d 20000008 00000000 000000
f544bac0 149231327 C Bo:2:033:1 0 31 >
f7a4c5c0 149231351 S Bi:2:033:2 -115 4096 <
f7a4c5c0 149231701 C Bi:2:033:2 0 4096 = 2e202020 20202020 20202010 000075b5 e63ae63a 000075b5 e63adf7f 00000000
f544bac0 149232494 S Bi:2:033:2 -115 13 <
f544bac0 149232577 C Bi:2:033:2 0 13 = 55534253 7d000000 00000000 00
f544bac0 149232830 S Bo:2:033:1 -115 31 = 55534243 7e000000 00020000 80000a28 0000041d 28000001 00000000 000000
f544bac0 149233703 C Bo:2:033:1 0 31 >
f7a4c5c0 149235038 S Bi:2:033:2 -115 512 <
f7a4c5c0 149235702 C Bi:2:033:2 0 512 = 2e202020 20202020 20202010 000076b5 e63ae63a 000076b5 e63ae07f 00000000
f544bac0 149235848 S Bi:2:033:2 -115 13 <
f544bac0 149235951 C Bi:2:033:2 0 13 = 55534253 7e000000 00000000 00
f544bac0 149235990 S Bo:2:033:1 -115 31 = 55534243 7f000000 000e0000 80000a28 0000041d 29000007 00000000 000000
f544bac0 149236701 C Bo:2:033:1 0 31 >
f7a4c5c0 149244334 S Bi:2:033:2 -115 3584 <
f7a4c5c0 149244702 C Bi:2:033:2 0 3584 = 00000000 00000000 00000000 00000000 00000000 00000000 00000000 00000000
f544bac0 149244719 S Bi:2:033:2 -115 13 <
f544bac0 149244826 C Bi:2:033:2 0 13 = 55534253 7f000000 00000000 00
f544bac0 150105911 S Bo:2:033:1 -115 31 = 55534243 80000000 00000000 00000600 00000000 00000000 00000000 000000
f544bac0 150106050 C Bo:2:033:1 0 31 >
f544bac0 150106055 S Bi:2:033:2 -115 13 <
f544bac0 150106674 C Bi:2:033:2 0 13 = 55534253 80000000 00000000 00
f544bac0 152098926 S Bo:2:033:1 -115 31 = 55534243 81000000 00000000 00000600 00000000 00000000 00000000 000000
f544bac0 152098986 C Bo:2:033:1 0 31 >
f544bac0 152098989 S Bi:2:033:2 -115 13 <
f544bac0 152099611 C Bi:2:033:2 0 13 = 55534253 81000000 00000000 00
f544bac0 154102936 S Bo:2:033:1 -115 31 = 55534243 82000000 00000000 00000600 00000000 00000000 00000000 000000
f544bac0 154103048 C Bo:2:033:1 0 31 >
f544bac0 154103054 S Bi:2:033:2 -115 13 <
f544bac0 154103547 C Bi:2:033:2 0 13 = 55534253 82000000 00000000 00
f544bac0 156102954 S Bo:2:033:1 -115 31 = 55534243 83000000 00000000 00000600 00000000 00000000 00000000 000000
f544bac0 156102987 C Bo:2:033:1 0 31 >
f544bac0 156102992 S Bi:2:033:2 -115 13 <
f544bac0 156103483 C Bi:2:033:2 0 13 = 55534253 83000000 00000000 00
f544bac0 156446017 S Bo:2:033:1 -115 31 = 55534243 84000000 00020000 00000a2a 00000000 01000001 00000000 000000
f544bac0 156446098 C Bo:2:033:1 0 31 >
f7a4c5c0 156446104 S Bo:2:033:1 -115 512 = 52526141 00000000 00000000 00000000 00000000 00000000 00000000 00000000
f7a4c5c0 156454474 C Bo:2:033:1 0 512 >
f544bac0 156454484 S Bi:2:033:2 -115 13 <
f544bac0 156454972 C Bi:2:033:2 0 13 = 55534253 84000000 00000000 00
f544bac0 156460718 S Bo:2:033:1 -115 31 = 55534243 85000000 00000000 00000600 00000000 00000000 00000000 000000
f544bac0 156461474 C Bo:2:033:1 0 31 >
f544bac0 156461576 S Bi:2:033:2 -115 13 <
f544bac0 156462475 C Bi:2:033:2 0 13 = 55534253 85000000 00000000 00
f544bac0 156465940 S Bo:2:033:1 -115 31 = 55534243 86000000 00000000 00000600 00000000 00000000 00000000 000000
f544bac0 156466475 C Bo:2:033:1 0 31 >
f544bac0 156466481 S Bi:2:033:2 -115 13 <
f544bac0 156466972 C Bi:2:033:2 0 13 = 55534253 86000000 00000000 00
f544bac0 156467072 S Bo:2:033:1 -115 31 = 55534243 87000000 00000000 0000061b 00000002 00000000 00000000 000000
f544bac0 156467471 C Bo:2:033:1 0 31 >
f544bac0 156467616 S Bi:2:033:2 -115 13 <
f544bac0 156607344 C Bi:2:033:2 0 13 = 55534253 87000000 00000000 00
f544bac0 158102928 S Bo:2:033:1 -115 31 = 55534243 88000000 00000000 00000600 00000000 00000000 00000000 000000
f544bac0 158103046 C Bo:2:033:1 0 31 >
f544bac0 158103052 S Bi:2:033:2 -115 13 <
f544bac0 158103420 C Bi:2:033:2 0 13 = 55534253 88000000 00000000 01
f544bac0 158103427 S Bo:2:033:1 -115 31 = 55534243 89000000 12000000 80000603 00000012 00000000 00000000 000000
f544bac0 158104420 C Bo:2:033:1 0 31 >
f22d6c40 158104428 S Bi:2:033:2 -115 18 <
f22d6c40 158105420 C Bi:2:033:2 0 18 = 70000200 0000000a 00000000 3a000000 0000
f544bac0 158105427 S Bi:2:033:2 -115 13 <
f544bac0 158105557 C Bi:2:033:2 0 13 = 55534253 89000000 00000000 00
f544bac0 158105601 S Bo:2:033:1 -115 31 = 55534243 8a000000 00000000 00000600 00000000 00000000 00000000 000000
f544bac0 158106421 C Bo:2:033:1 0 31 >
f544bac0 158106428 S Bi:2:033:2 -115 13 <
f544bac0 158106920 C Bi:2:033:2 0 13 = 55534253 8a000000 00000000 01
f544bac0 158107516 S Bo:2:033:1 -115 31 = 55534243 8b000000 12000000 80000603 00000012 00000000 00000000 000000
f544bac0 158108421 C Bo:2:033:1 0 31 >
f57f0540 158108431 S Bi:2:033:2 -115 18 <
f57f0540 158109420 C Bi:2:033:2 0 18 = 70000200 0000000a 00000000 3a000000 0000
f544bac0 158109427 S Bi:2:033:2 -115 13 <
f544bac0 158109546 C Bi:2:033:2 0 13 = 55534253 8b000000 00000000 00
f544bac0 158116512 S Bo:2:033:1 -115 31 = 55534243 8c000000 00000000 00000600 00000000 00000000 00000000 000000
f544bac0 158117421 C Bo:2:033:1 0 31 >
f544bac0 158117426 S Bi:2:033:2 -115 13 <
f544bac0 158118419 C Bi:2:033:2 0 13 = 55534253 8c000000 00000000 01
f544bac0 158118475 S Bo:2:033:1 -115 31 = 55534243 8d000000 12000000 80000603 00000012 00000000 00000000 000000
f544bac0 158118919 C Bo:2:033:1 0 31 >
f57f0540 158118971 S Bi:2:033:2 -115 18 <
f57f0540 158119420 C Bi:2:033:2 0 18 = 70000200 0000000a 00000000 3a000000 0000
f544bac0 158119815 S Bi:2:033:2 -115 13 <
f544bac0 158119920 C Bi:2:033:2 0 13 = 55534253 8d000000 00000000 00
f544bac0 158119953 S Bo:2:033:1 -115 31 = 55534243 8e000000 00000000 00000600 00000000 00000000 00000000 000000
f544bac0 158120420 C Bo:2:033:1 0 31 >
f544bac0 158120426 S Bi:2:033:2 -115 13 <
f544bac0 158121420 C Bi:2:033:2 0 13 = 55534253 8e000000 00000000 01
f544bac0 158123090 S Bo:2:033:1 -115 31 = 55534243 8f000000 12000000 80000603 00000012 00000000 00000000 000000
f544bac0 158123425 C Bo:2:033:1 0 31 >
f57f0540 158123435 S Bi:2:033:2 -115 18 <
f57f0540 158124420 C Bi:2:033:2 0 18 = 70000200 0000000a 00000000 3a000000 0000
f544bac0 158124428 S Bi:2:033:2 -115 13 <
f544bac0 158124544 C Bi:2:033:2 0 13 = 55534253 8f000000 00000000 00
f544bac0 158124587 S Bo:2:033:1 -115 31 = 55534243 90000000 00000000 00000600 00000000 00000000 00000000 000000
f544bac0 158125419 C Bo:2:033:1 0 31 >
f544bac0 158125424 S Bi:2:033:2 -115 13 <
f544bac0 158126419 C Bi:2:033:2 0 13 = 55534253 90000000 00000000 01
f544bac0 158126426 S Bo:2:033:1 -115 31 = 55534243 91000000 12000000 80000603 00000012 00000000 00000000 000000
f544bac0 158126919 C Bo:2:033:1 0 31 >
f57f0540 158126926 S Bi:2:033:2 -115 18 <
f57f0540 158127419 C Bi:2:033:2 0 18 = 70000200 0000000a 00000000 3a000000 0000
f544bac0 158127426 S Bi:2:033:2 -115 13 <
f544bac0 158127544 C Bi:2:033:2 0 13 = 55534253 91000000 00000000 00
f544bac0 158127594 S Bo:2:033:1 -115 31 = 55534243 92000000 00000000 00000600 00000000 00000000 00000000 000000
f544bac0 158128419 C Bo:2:033:1 0 31 >
f544bac0 158128425 S Bi:2:033:2 -115 13 <
f544bac0 158129419 C Bi:2:033:2 0 13 = 55534253 92000000 00000000 01
f544bac0 158129425 S Bo:2:033:1 -115 31 = 55534243 93000000 12000000 80000603 00000012 00000000 00000000 000000
f544bac0 158130419 C Bo:2:033:1 0 31 >
f57f0540 158130425 S Bi:2:033:2 -115 18 <
f57f0540 158130919 C Bi:2:033:2 0 18 = 70000200 0000000a 00000000 3a000000 0000
f544bac0 158131016 S Bi:2:033:2 -115 13 <
f544bac0 158131045 C Bi:2:033:2 0 13 = 55534253 93000000 00000000 00
f544bac0 158131070 S Bo:2:033:1 -115 31 = 55534243 94000000 00000000 00000600 00000000 00000000 00000000 000000
f544bac0 158131419 C Bo:2:033:1 0 31 >
f544bac0 158131426 S Bi:2:033:2 -115 13 <
f544bac0 158132419 C Bi:2:033:2 0 13 = 55534253 94000000 00000000 01
f544bac0 158132426 S Bo:2:033:1 -115 31 = 55534243 95000000 12000000 80000603 00000012 00000000 00000000 000000
f544bac0 158133419 C Bo:2:033:1 0 31 >
f57f0540 158133426 S Bi:2:033:2 -115 18 <
f57f0540 158134419 C Bi:2:033:2 0 18 = 70000200 0000000a 00000000 3a000000 0000
f544bac0 158134426 S Bi:2:033:2 -115 13 <
f544bac0 158134545 C Bi:2:033:2 0 13 = 55534253 95000000 00000000 00
f544bac0 160103219 S Bo:2:033:1 -115 31 = 55534243 96000000 00000000 00000600 00000000 00000000 00000000 000000
f544bac0 160103358 C Bo:2:033:1 0 31 >
f544bac0 160103365 S Bi:2:033:2 -115 13 <
f544bac0 160104357 C Bi:2:033:2 0 13 = 55534253 96000000 00000000 01
f544bac0 160104364 S Bo:2:033:1 -115 31 = 55534243 97000000 12000000 80000603 00000012 00000000 00000000 000000
f544bac0 160105356 C Bo:2:033:1 0 31 >
e16cd2c0 160105364 S Bi:2:033:2 -115 18 <
e16cd2c0 160106356 C Bi:2:033:2 0 18 = 70000200 0000000a 00000000 3a000000 0000
f544bac0 160106364 S Bi:2:033:2 -115 13 <
f544bac0 160106483 C Bi:2:033:2 0 13 = 55534253 97000000 00000000 00
f544bac0 160106510 S Bo:2:033:1 -115 31 = 55534243 98000000 00000000 00000600 00000000 00000000 00000000 000000
f544bac0 160107361 C Bo:2:033:1 0 31 >
f544bac0 160107367 S Bi:2:033:2 -115 13 <
f544bac0 160107607 C Bi:2:033:2 0 13 = 55534253 98000000 00000000 01
f544bac0 160107613 S Bo:2:033:1 -115 31 = 55534243 99000000 12000000 80000603 00000012 00000000 00000000 000000
f544bac0 160108356 C Bo:2:033:1 0 31 >
e16cd2c0 160108363 S Bi:2:033:2 -115 18 <
e16cd2c0 160109356 C Bi:2:033:2 0 18 = 70000200 0000000a 00000000 3a000000 0000
f544bac0 160109362 S Bi:2:033:2 -115 13 <
f544bac0 160109482 C Bi:2:033:2 0 13 = 55534253 99000000 00000000 00
